StockCode,Description,TotalQuantitySold,Revenue,OrderCount
22423,REGENCY CAKESTAND 3 TIER,24124,277656.25,3317
85123A,WHITE HANGING HEART T-LIGHT HOLDER,91757,247048.01,4888
23843,"PAPER CRAFT , LITTLE BIRDIE",80995,168469.6,1
M,Manual,9384,151777.67,620
85099B,JUMBO BAG RED RETROSPOT,74224,134307.44,2612
POST,POSTAGE,5235,124648.04,1803
84879,ASSORTED COLOUR BIRD ORNAMENT,78234,124351.86,2652
47566,PARTY BUNTING,23460,103283.38,2077
23166,MEDIUM CERAMIC TOP STORAGE JAR,77916,81416.73000000001,195
22086,PAPER CHAIN KIT 50'S CHRISTMAS ,28380,76598.18000000001,1691
79321,CHILLI LIGHTS,14843,69084.3,922
85099F,JUMBO BAG STRAWBERRY,35842,64127.77,1514
21137,BLACK RECORD COVER FRAME,18417,63092.12,539
84347,ROTATING SILVER ANGELS T-LIGHT HLDR,28606,55880.17,525
82484,WOOD BLACK BOARD ANT WHITE FINISH,9678,54525.36,1048
21621,VINTAGE UNION JACK BUNTING,6497,54432.62,1121
15056N,EDWARDIAN PARASOL NATURAL,10948,54332.61,863
85099C,JUMBO  BAG BAROQUE BLACK WHITE,28899,52188.18,1449
23084,RABBIT NIGHT LIGHT,27153,51251.24,801
22470,HEART OF WICKER LARGE,17104,49859.5,1743
21733,RED HANGING HEART T-LIGHT HOLDER,17228,48850.6,1631
21931,JUMBO STORAGE BAG SUKI,25970,47760.99,1714
22189,CREAM HEART CARD HOLDER,15946,47414.200000000004,1129
15056BL,EDWARDIAN PARASOL BLACK,9351,45885.07,788
22178,VICTORIAN GLASS HANGING T-LIGHT,37285,45746.75,1442
22112,CHOCOLATE HOT WATER BOTTLE,9904,45601.340000000004,1447
22411,JUMBO SHOPPER VINTAGE RED PAISLEY,24295,45059.13,1680
22910,PAPER CHAIN KIT VINTAGE CHRISTMAS,16469,44998.270000000004,1233
21623,VINTAGE UNION JACK MEMOBOARD,6125,44785.83,499
21181,PLEASE ONE PERSON METAL SIGN,22379,44310.600000000006,1399
22386,JUMBO BAG PINK POLKADOT,23572,43319.16,1055
22469,HEART OF WICKER SMALL,26193,43316.54,1779
21929,JUMBO BAG PINK VINTAGE PAISLEY,24108,43313.9,1228
22138,BAKING SET 9 PIECE RETROSPOT ,9035,43070.91,1742
21843,RED RETROSPOT CAKE STAND,4298,42862.74,984
22111,SCOTTIE DOG HOT WATER BOTTLE,9092,42463.200000000004,1457
21754,HOME BUILDING BLOCK WORD,7231,42453.11,1831
21731,RED TOADSTOOL LED NIGHT LIGHT,27102,41824.26,1043
21175,GIN + TONIC DIET METAL SIGN,19755,40940.78,1385
22457,NATURAL SLATE HEART CHALKBOARD ,14187,40276.170000000006,1637
22326,ROUND SNACK BOXES SET OF4 WOODLAND ,14630,40219.82,1144
48138,DOORMAT UNION FLAG,6146,40053.72,874
82494L,WOODEN FRAME ANTIQUE WHITE ,14368,39909.170000000006,1773
20727,LUNCH BAG  BLACK SKULL.,25392,39904.0,1997
21915,RED  HARMONICA IN BOX ,35229,39870.65,884
71477,COLOUR GLASS. STAR T-LIGHT HOLDER,13874,39822.34,644
21232,STRAWBERRY CERAMIC TRINKET BOX,33899,39682.67,1818
22502,PICNIC BASKET WICKER 60 PIECES,61,39619.5,2
21166,COOK WITH WINE METAL SIGN ,19652,37029.340000000004,1225
82482,WOODEN PICTURE FRAME WHITE FINISH,15643,37011.1,1658
20728,LUNCH BAG CARS BLUE,23304,36644.28,1797
84078A,SET/4 WHITE RETRO STORAGE CUBES ,1007,36259.65,234
22629,SPACEBOY LUNCH BOX ,20271,36150.99,1108
23284,DOORMAT KEEP CALM AND COME IN,5338,35880.85,648
23298,SPOTTY BUNTING,7633,35509.55,1003
85066,CREAM SWEETHEART MINI CHEST,2948,35264.729999999996,809
20713,JUMBO BAG OWLS,19463,35162.42,920
48194,DOORMAT HEARTS,5788,35069.4,857
22114,HOT WATER BOTTLE TEA AND SYMPATHY,8848,34479.62,1298
22960,JAM MAKING SET WITH JARS,8454,33833.72,903
22328,ROUND SNACK BOXES SET OF 4 FRUITS ,12356,33670.240000000005,985
22720,SET OF 3 CAKE TINS PANTRY DESIGN ,7010,33298.3,1146
20726,LUNCH BAG WOODLAND,20916,33004.76,1585
22197,SMALL POPCORN HOLDER,42955,32505.93,1039
22699,ROSES REGENCY TEACUP AND SAUCER ,11939,32470.65,1056
20725,LUNCH BAG RED RETROSPOT,20294,32137.5,1520
84029E,RED WOOLLY HOTTIE WHITE HEART.,9259,31876.47,956
20685,DOORMAT RED RETROSPOT,4806,31864.2,758
21755,LOVE BUILDING BLOCK WORD,5367,31590.41,1485
48187,DOORMAT NEW ENGLAND,5146,31461.34,728
22630,DOLLY GIRL LUNCH BOX,17340,30921.64,998
22727,ALARM CLOCK BAKELIKE RED ,8512,30703.09,1144
85152,HAND OVER THE CHOCOLATE   SIGN ,16146,30615.930000000004,1300
82486,WOOD S/3 CABINET ANT WHITE FINISH,3913,30363.75,1002
22382,LUNCH BAG SPACEBOY DESIGN ,18834,30131.7,1874
22385,JUMBO BAG SPACEBOY DESIGN,16383,29810.15,971
21523,DOORMAT FANCY FONT HOME SWEET HOME,4825,29691.95,572
48185,DOORMAT FAIRY CAKE,4760,29116.96,420
20712,JUMBO BAG WOODLAND ANIMALS,15709,29105.5,915
15036,ASSORTED COLOURS SILK FAN,40994,28766.32,634
47590B,PINK HAPPY BIRTHDAY BUNTING,5652,28581.4,810
20679,EDWARDIAN PARASOL RED,6029,28557.920000000002,622
20914,SET/5 RED SPOTTY LID GLASS BOWLS,10526,28513.300000000003,787
82483,WOOD 2 DRAWER CABINET WHITE FINISH,4774,27952.22,1053
22379,RECYCLING BAG RETROSPOT ,14259,27893.78,1013
22139,RETROSPOT TEA SET CERAMIC 11 PC ,5745,27595.33,1145
22865,HAND WARMER OWL DESIGN,13675,27514.63,1058
22188,BLACK HEART CARD HOLDER,10255,27324.45,487
22622,BOX OF VINTAGE ALPHABET BLOCKS,2833,27251.26,511
20725,LUNCH BAG RED SPOTTY,17456,27237.6,1059
22666,RECIPE BOX PANTRY YELLOW DESIGN,9600,27222.52,1277
22077,6 RIBBONS RUSTIC CHARM,16026,27031.04,1361
21928,JUMBO BAG SCANDINAVIAN PAISLEY,15358,26847.1,721
22659,LUNCH BOX I LOVE LONDON,15156,26596.719999999998,763
23245,SET OF 3 REGENCY CAKE TINS,5844,26566.280000000002,718
23199,JUMBO BAG APPLES,13875,26426.3,718
21977,PACK OF 60 PINK PAISLEY CAKE CASES,54592,26407.35,1578
22467,GUMBALL COAT RACK,11460,26149.13,928
22492,MINI PAINT SET VINTAGE ,41507,25900.19,618
72741,GRAND CHOCOLATECANDLE,19284,25895.4,823
84991,60 TEATIME FAIRY CAKE CASES,52828,25785.92,1765
22752,SET 7 BABUSHKA NESTING BOXES,3273,25620.99,577
22726,ALARM CLOCK BAKELIKE GREEN,6713,24898.96,1041
22386,JUMBO BAG PINK WITH WHITE SPOTS,13766,24450.6,712
85099B,JUMBO BAG RED WHITE SPOTTY ,13879,24323.85,465
23355,HOT WATER BOTTLE KEEP CALM,5313,24302.55,719
47566B,TEA TIME PARTY BUNTING,5612,24255.3,655
22149,FELTCRAFT 6 FLOWER FRIENDS,12174,24248.29,1189
48138,DOOR MAT UNION FLAG,3733,24216.23,637
23201,JUMBO BAG ALPHABET,12533,24160.44,752
22624,IVORY KITCHEN SCALES,2916,24137.48,1065
84077,WORLD WAR 2 GLIDERS ASSTD DESIGNS,105185,24098.03,920
20972,PINK CREAM FELT CRAFT TRINKET BOX ,20064,23812.52,1224
37503,TEA TIME CAKE STAND IN GIFT BOX,2384,23784.8,465
84755,COLOUR GLASS T-LIGHT HOLDER HANGING,39259,23598.510000000002,1100
20971,PINK BLUE FELT CRAFT TRINKET BOX,20500,23554.3,1003
47590A,BLUE HAPPY BIRTHDAY BUNTING,4681,23531.47,633
22697,GREEN REGENCY TEACUP AND SAUCER,8500,23507.24,933
22866,HAND WARMER SCOTTY DOG DESIGN,11667,23436.660000000003,939
22197,POPCORN HOLDER,30919,23417.51,632
84836,ZINC METAL HEART DECORATION,19328,23331.43,1244
21108,FAIRY CAKE FLANNEL ASSORTED COLOUR,12532,23322.62,408
22551,PLASTERS IN TIN SPACEBOY,14623,23194.95,1156
21485,RETROSPOT HEART HOT WATER BOTTLE,4895,23085.53,815
22507,MEMO BOARD RETROSPOT  DESIGN,5208,23083.44,737
22084,PAPER CHAIN KIT EMPIRE,8437,23049.95,704
23173,REGENCY TEAPOT ROSES ,2662,23033.52,354
82583,HOT BATHS METAL SIGN,11797,23010.120000000003,820
71459,HANGING JAM JAR T-LIGHT HOLDER,29255,22805.99,815
21930,JUMBO STORAGE BAG SKULLS,12305,22795.28,997
22158,3 HEARTS HANGING DECORATION RUSTIC,7982,22471.86,646
22961,JAM MAKING SET PRINTED,15867,22328.95,903
22867,HAND WARMER BIRD DESIGN,11000,22168.33,907
23243,SET OF TEA COFFEE SUGAR TINS PANTRY,4658,22109.079999999998,385
82600,NO SINGING METAL SIGN,11194,22097.04,970
84978,HANGING HEART JAR T-LIGHT HOLDER,19012,22079.739999999998,1087
22383,LUNCH BAG SUKI  DESIGN ,13896,22026.4,1073
21212,PACK OF 72 RETRO SPOT CAKE CASES,45129,21838.23,1160
21231,SWEETHEART CERAMIC TRINKET BOX,18488,21793.25,1171
21481,FAWN BLUE HOT WATER BOTTLE,7526,21779.5,834
20914,SET/5 RED RETROSPOT LID GLASS BOWLS,7709,21682.030000000002,1003
21212,PACK OF 72 RETROSPOT CAKE CASES,44721,21551.8,1348
84946,ANTIQUE SILVER TEA GLASS ETCHED,18604,21540.440000000002,789
22734,SET OF 6 RIBBONS VINTAGE CHRISTMAS,8849,21490.170000000002,599
22171,3 HOOK PHOTO SHELF ANTIQUE WHITE,2999,21458.42,544
22835,HOT WATER BOTTLE I AM SO POORLY,4638,21398.28,815
22728,ALARM CLOCK BAKELIKE PINK,5833,21369.98,772
22087,PAPER BUNTING WHITE LACE,7752,21336.350000000002,663
84406B,CREAM CUPID HEARTS COAT HANGER,6682,21256.0,724
20749,ASSORTED COLOUR MINI CASES,2972,21169.64,726
22607,WOODEN ROUNDERS GARDEN SET ,2406,20978.47,643
22113,GREY HEART HOT WATER BOTTLE,5623,20977.78,913
22556,PLASTERS IN TIN CIRCUS PARADE ,13112,20950.16,1100
22090,PAPER BUNTING RETROSPOT,7632,20933.24,658
23202,JUMBO BAG VINTAGE LEAF,10695,20921.55,772
84029G,KNITTED UNION FLAG HOT WATER BOTTLE,5724,20838.9,758
22605,WOODEN CROQUET GARDEN SET,1710,20813.809999999998,548
22090,PAPER BUNTING RETRO SPOTS,7595,20723.25,607
23203,JUMBO BAG VINTAGE DOILY ,10620,20641.4,621
21314,SMALL GLASS HEART TRINKET POT,10447,20588.260000000002,711
22722,SET OF 6 SPICE TINS PANTRY DESIGN,5366,20506.300000000003,654
22554,PLASTERS IN TIN WOODLAND ANIMALS,12824,20471.68,1097
22698,PINK REGENCY TEACUP AND SAUCER,7408,20329.640000000003,746
48184,DOORMAT ENGLISH ROSE ,3158,20298.8,464
20711,JUMBO BAG TOYS ,11326,20283.78,671
22969,HOMEMADE JAM SCENTED CANDLES,14012,20204.8,577
37449,CERAMIC CAKE STAND + HANGING CAKES,2277,20204.579999999998,410
21790,VINTAGE SNAP CARDS,25120,19957.34,1480
22585,PACK OF 6 BIRDY GIFT TAGS,16784,19950.85,950
22139,RETRO SPOT TEA SET CERAMIC 11 PC ,4304,19921.27,692
84970S,HANGING HEART ZINC T-LIGHT HOLDER,25389,19821.96,1141
22083,PAPER CHAIN KIT RETRO SPOT,7351,19804.550000000003,490
22617,BAKING SET SPACEBOY DESIGN,4165,19719.21,883
22294,HEART FILIGREE DOVE  SMALL,16260,19686.6,707
22941,CHRISTMAS LIGHTS 10 REINDEER,2487,19590.9,406
22273,FELTCRAFT DOLL MOLLY,7203,19332.93,701
22570,FELTCRAFT CUSHION RABBIT,5420,19282.55,677
21524,DOORMAT SPOTTY HOME SWEET HOME,2671,19215.5,636
48188,DOORMAT WELCOME PUPPIES,3345,19178.670000000002,368
22625,RED KITCHEN SCALES,2360,19149.63,781
21791,VINTAGE HEADS AND TAILS CARD GAME ,16199,19147.65,1050
22568,FELTCRAFT CUSHION OWL,5312,19128.13,771
22569,FELTCRAFT CUSHION BUTTERFLY,5357,18865.21,679
22413,METAL SIGN TAKE IT OR LEAVE IT ,6814,18863.02,766
85150,LADIES & GENTLEMEN METAL SIGN,8078,18847.98,889
22693,GROW A FLYTRAP OR SUNFLOWER IN TIN,17242,18798.98,281
22501,PICNIC BASKET WICKER LARGE,2055,18794.25,497
85048,15CM CHRISTMAS GLASS BALL 20 LIGHTS,2525,18618.75,432
21622,VINTAGE UNION JACK CUSHION COVER,3517,18495.47,550
22558,CLOTHES PEGS RETROSPOT PACK 24 ,13410,18411.74,1017
21213,PACK OF 72 SKULL CAKE CASES,38530,18319.18,1156
22499,WOODEN UNION JACK BUNTING,3165,18251.280000000002,632
23206,LUNCH BAG APPLE DESIGN,11530,18220.5,866
22384,LUNCH BAG PINK POLKADOT,11392,18207.2,1101
21908,CHOCOLATE THIS WAY METAL SIGN,9396,18041.24,801
84949,SILVER HANGING T-LIGHT HOLDER,11635,18001.35,612
21340,CLASSIC METAL BIRDCAGE PLANT HOLDER,1702,17888.71,383
22561,WOODEN SCHOOL COLOURING SET,11158,17861.22,838
21174,POTTERING IN THE SHED METAL SIGN,9247,17814.51,855
22555,PLASTERS IN TIN STRONGMAN,11048,17664.44,856
22456,NATURAL SLATE CHALKBOARD LARGE ,4016,17637.16,595
23344,JUMBO BAG 50'S CHRISTMAS ,8933,17636.04,586
22427,ENAMEL FLOWER JUG CREAM,3039,17471.23,702
21936,RED RETROSPOT PICNIC BAG,6292,17462.96,701
22061,LARGE CAKE STAND  HANGING STRAWBERY,2086,17354.85,443
22147,FELTCRAFT BUTTERFLY HEARTS,12605,17238.05,1026
84947,ANTIQUE SILVER TEA GLASS ENGRAVED,15028,17162.93,559
21479,WHITE SKULL HOT WATER BOTTLE ,4538,16917.32,738
21136,PAINTED METAL PEARS ASSORTED,10255,16907.51,714
22633,HAND WARMER UNION JACK,8364,16857.36,790
22560,TRADITIONAL MODELLING CLAY,14393,16851.64,655
84945,MULTI COLOUR SILVER T-LIGHT HOLDER,21125,16833.35,585
23203,JUMBO BAG DOILEY PATTERNS,8735,16737.1,454
22169,FAMILY ALBUM WHITE PICTURE FRAME,2094,16676.94,570
22505,MEMO BOARD COTTAGE DESIGN,3605,16599.89,655
21218,RED SPOTTY BISCUIT TIN,4715,16431.45,588
22847,BREAD BIN DINER STYLE IVORY,1049,16335.789999999999,435
84992,72 SWEETHEART FAIRY CAKE CASES,33936,16178.47,1176
21527,RED RETROSPOT TRADITIONAL TEAPOT ,2266,15892.74,508
21164,HOME SWEET HOME METAL SIGN ,5839,15888.490000000002,630
22297,HEART IVORY TRELLIS SMALL,12939,15836.59,646
22424,ENAMEL BREAD BIN CREAM,1300,15621.65,559
48173C,DOORMAT BLACK FLOCK ,2813,15618.36,290
22557,PLASTERS IN TIN VINTAGE PAISLEY ,9827,15614.59,991
22083,PAPER CHAIN KIT RETROSPOT,5514,15411.86,585
21877,HOME SWEET HOME MUG,13856,15399.56,650
22383,LUNCH BAG SUKI DESIGN ,9570,15332.9,899
22690,DOORMAT HOME SWEET HOME BLUE ,2493,15329.57,401
71053,WHITE METAL LANTERN,4306,15309.64,583
22662,LUNCH BAG DOLLY GIRL DESIGN,9715,15305.19,872
22632,HAND WARMER RED RETROSPOT,7578,15272.52,675
84970L,SINGLE HEART ZINC T-LIGHT HOLDER,16445,15241.51,821
21559,STRAWBERRY LUNCH BOX WITH CUTLERY,6418,15232.34,798
22296,HEART IVORY TRELLIS LARGE,9416,15218.08,739
84946,ANTIQUE SILVER T-LIGHT GLASS,12949,15176.42,534
72760B,VINTAGE CREAM 3 BASKET CAKE STAND,1632,15172.6,444
20685,DOOR MAT RED SPOT,2426,15093.48,369
22041,"RECORD FRAME 7"" SINGLE SIZE ",6845,15088.77,319
21843,RETRO SPOT CAKE STAND,1431,15083.449999999999,295
84997D,PINK 3 PIECE MINI DOTS CUTLERY SET,4198,15067.14,416
20719,WOODLAND CHARLOTTE BAG,19027,15030.64,1062
22634,CHILDS BREAKFAST SET SPACEBOY ,1627,15021.4,464
22502,PICNIC BASKET WICKER SMALL,2985,14945.6,566
22652,TRAVEL SEWING KIT,9353,14859.81,716
21975,PACK OF 60 DINOSAUR CAKE CASES,30881,14818.01,1133
85014B,RED/WHITE DOTS RUFFLED UMBRELLA,3405,14796.15,373
22635,CHILDS BREAKFAST SET DOLLY GIRL ,1598,14787.949999999999,450
21430,SET/3 RED GINGHAM ROSE STORAGE BOX,4169,14719.35,578
21914,BLUE HARMONICA IN BOX ,11830,14667.47,815
22170,PICTURE FRAME WOOD TRIPLE PORTRAIT,2309,14658.65,510
17003,BROCADE RING PURSE ,70082,14640.96,387
21928,JUMBO BAG SCANDINAVIAN BLUE PAISLEY,7754,14626.73,451
84997B,RED 3 PIECE MINI DOTS CUTLERY SET,4051,14609.91,460
21891,TRADITIONAL WOODEN SKIPPING ROPE,11721,14603.13,664
82582,AREA PATROLLED METAL SIGN,7346,14563.1,696
84375,SET OF 20 KIDS COOKIE CUTTERS,7275,14558.970000000001,626
20750,RED RETROSPOT MINI CASES,2021,14548.55,479
22193,RED DINER WALL CLOCK,1775,14527.09,554
85014B,RED RETROSPOT UMBRELLA,2613,14439.12,421
21889,WOODEN BOX OF DOMINOES,11803,14430.66,869
21258,VICTORIAN SEWING BOX LARGE,1229,14406.63,344
22487,WHITE WOOD GARDEN PLANT LADDER,1519,14256.96,808
22993,SET OF 4 PANTRY JELLY MOULDS,11769,14151.42,866
22759,SET OF 3 NOTEBOOKS IN PARCEL,8860,14138.4,634
21484,CHICK GREY HOT WATER BOTTLE,4085,14071.27,676
21165,BEWARE OF THE CAT METAL SIGN ,9080,14070.08,779
22619,SET OF 6 SOLDIER SKITTLES,3762,13950.85,574
21770,OPEN CLOSED METAL SIGN,2896,13926.810000000001,580
22384,LUNCH BAG PINK RETROSPOT,8738,13893.7,730
84378,SET OF 3 HEART COOKIE CUTTERS,11007,13862.84,944
22837,HOT WATER BOTTLE BABUSHKA ,3093,13807.25,354
84997C,BLUE 3 PIECE MINI DOTS CUTLERY SET,3820,13805.16,445
84997D,CHILDRENS CUTLERY POLKADOT PINK,3528,13788.300000000001,323
21380,WOODEN HAPPY BIRTHDAY GARLAND,4877,13770.150000000001,540
22606,WOODEN SKITTLES GARDEN SET,1022,13722.74,337
35004C,SET OF 3 COLOURED  FLYING DUCKS,2851,13577.15,229
48111,DOORMAT 3 SMILEY CATS,2290,13552.78,326
22940,FELTCRAFT CHRISTMAS FAIRY,3286,13462.18,547
21217,RED SPOTTY ROUND CAKE TINS,1415,13458.25,418
21169,YOU'RE CONFUSING ME METAL SIGN ,8642,13438.58,621
47556B,TEA TIME TEA TOWELS ,5141,13363.35,408
84050,PINK HEART SHAPE EGG FRYING PAN,9547,13316.63,557
22191,IVORY DINER WALL CLOCK,1629,13271.9,475
22271,FELTCRAFT DOLL ROSIE,4744,13244.460000000001,691
79323P,PINK CHERRY LIGHTS,2234,13198.1,229
22295,HEART FILIGREE DOVE LARGE,8159,13184.07,620
22692,DOORMAT WELCOME TO OUR HOME,1935,13103.81,460
21094,SET/6 RED SPOTTY PAPER PLATES,17752,13068.56,692
23200,JUMBO BAG PEARS,6729,13034.92,470
23108,SET OF 10 LED DOLLY LIGHTS,2192,12972.73,351
23313,VINTAGE CHRISTMAS BUNTING,2748,12960.12,359
23356,LOVE HOT WATER BOTTLE,2325,12954.75,449
22236,CAKE STAND 3 TIER MAGIC GARDEN,1074,12951.9,391
22730,ALARM CLOCK BAKELIKE IVORY,3451,12951.5,616
21390,FILIGRIS HEART WITH BUTTERFLY,10622,12849.14,482
22173,METAL 4 HOOK HANGER FRENCH CHATEAU,4538,12846.140000000001,714
35970,ZINC FOLKART SLEIGH BELLS,7851,12806.27,545
15044A,PINK PAPER PARASOL ,4894,12803.78,194
22621,TRADITIONAL KNITTING NANCY,8365,12780.57,719
21704,BAG 250g SWIRLY MARBLES,16824,12750.539999999999,464
22636,CHILDS BREAKFAST SET CIRCUS PARADE,1565,12716.380000000001,460
22352,LUNCH BOX WITH CUTLERY RETROSPOT ,5331,12669.04,645
22946,WOODEN ADVENT CALENDAR CREAM,869,12588.45,208
22952,60 CAKE CASES VINTAGE CHRISTMAS,25179,12556.77,801
22655,VINTAGE RED KITCHEN CABINET,75,12550.0,52
C2,CARRIAGE,249,12546.0,248
48116,DOORMAT MULTICOLOUR STRIPE,2273,12541.22,193
48187,DOOR MAT NEW ENGLAND,1953,12520.95,423
22150,3 STRIPEY MICE FELTCRAFT,6971,12515.65,717
21871,SAVE THE PLANET MUG,11099,12515.44,600
23301,GARDENERS KNEELING PAD KEEP CALM ,7722,12463.78,756
62018,SOMBRERO ,9548,12413.8,123
21259,VICTORIAN SEWING BOX SMALL ,2171,12409.960000000001,553
22749,FELTCRAFT PRINCESS CHARLOTTE DOLL,3407,12407.83,621
21672,WHITE SPOT RED CERAMIC DRAWER KNOB,10290,12354.22,625
48129,DOORMAT TOPIARY,2048,12345.7,300
22766,PHOTO FRAME CORNICE,4246,12280.18,580
22355,CHARLOTTE BAG SUKI DESIGN,15411,12268.65,957
22627,MINT KITCHEN SCALES,1476,12219.99,558
22303,COFFEE MUG APPLES DESIGN,5310,12179.95,480
75049L,LARGE CIRCULAR MIRROR MOBILE,13566,12173.5,230
21912,VINTAGE SNAKES & LADDERS,3387,12157.97,615
22485,SET OF 2 WOODEN MARKET CRATES,995,12146.25,341
22776,SWEETHEART CAKESTAND 3 TIER,1292,12130.4,466
22909,SET OF 20 VINTAGE CHRISTMAS NAPKINS,15376,12124.119999999999,889
21669,BLUE STRIPE CERAMIC DRAWER KNOB,9897,12115.21,639
85014A,BLACK/BLUE DOTS RUFFLED UMBRELLA,2944,12089.2,283
85042,ANTIQUE LILY FAIRY LIGHTS,2668,12081.0,281
20724,RED RETROSPOT CHARLOTTE BAG,15168,12034.8,908
23207,LUNCH BAG ALPHABET DESIGN,7533,11994.41,647
21217,RED RETROSPOT ROUND CAKE TINS,1268,11983.6,350
22366,DOORMAT AIRMAIL ,1943,11946.53,320
22553,PLASTERS IN TIN SKULLS,7363,11913.75,905
21535,RED RETROSPOT SMALL MILK JUG,4943,11908.050000000001,713
DOT,DOTCOM POSTAGE,16,11906.36,16
22846,BREAD BIN DINER STYLE RED ,771,11879.06,309
21888,BINGO SET,3219,11877.45,626
15056P,EDWARDIAN PARASOL PINK,2436,11872.810000000001,321
84380,SET OF 3 BUTTERFLY COOKIE CUTTERS,9592,11818.65,814
84212,"ASSORTED FLOWER COLOUR ""LEIS""",24665,11759.77,258
22584,PACK OF 6 PANNETONE GIFT BOXES,4793,11725.480000000001,498
21955,DOORMAT UNION JACK GUNS AND ROSES,2078,11722.24,275
79323W, WHITE CHERRY LIGHTS,1986,11697.300000000001,215
20723,STRAWBERRY CHARLOTTE BAG,14542,11654.8,988
23077,DOUGHNUT LIP GLOSS ,9642,11615.7,308
22654,DELUXE SEWING KIT ,2045,11611.27,440
23174,REGENCY SUGAR BOWL GREEN,2954,11567.24,268
21156,RETROSPOT CHILDRENS APRON,6437,11562.37,526
22464,HANGING METAL HEART LANTERN,7388,11530.56,645
22838,3 TIER CAKE TIN RED AND CREAM,844,11467.38,220
21668,RED STRIPE CERAMIC DRAWER KNOB,9391,11446.75,614
22804,CANDLEHOLDER PINK HANGING HEART,4069,11400.75,521
22192,BLUE DINER WALL CLOCK,1373,11358.78,511
47567B,TEA TIME KITCHEN APRON,2128,11321.320000000002,320
21080,SET/20 RED SPOTTY PAPER NAPKINS ,15165,11310.21,781
22207,FRYING PAN UNION FLAG,2858,11283.86,324
22365,DOORMAT RESPECTABLE HOUSE,1863,11282.69,244
21080,SET/20 RED RETROSPOT PAPER NAPKINS ,14329,11229.27,890
22646,CERAMIC STRAWBERRY CAKE MONEY BANK,8514,11187.26,697
22082,RIBBON REEL STRIPES DESIGN ,6878,11166.78,819
20969,RED FLORAL FELTCRAFT SHOULDER BAG,3090,11155.41,518
22623,BOX OF VINTAGE JIGSAW BLOCKS ,2195,11129.42,500
22750,FELTCRAFT PRINCESS LOLA DOLL,3039,11094.51,597
21906,PHARMACIE FIRST AID TIN,1642,11093.9,311
22088,PAPER BUNTING COLOURED LACE,4038,11086.900000000001,478
21485,RED SPOT HEART HOT WATER BOTTLE,2362,11031.1,410
21673,WHITE SPOT BLUE CERAMIC DRAWER KNOB,9171,11022.43,563
84987,SET OF 36 TEATIME PAPER DOILIES,7832,11012.88,642
22444,GROW YOUR OWN PLANT IN A CAN ,8960,10976.56,328
22151,PLACE SETTING WHITE HEART,27085,10910.31,645
47599A,PINK PARTY BAGS,5878,10841.48,325
22301,COFFEE MUG CAT + BIRD DESIGN,4733,10831.29,466
22631,CIRCUS PARADE LUNCH BOX ,5871,10791.83,468
72351B,SET/6 PINK  BUTTERFLY T-LIGHTS,5681,10779.640000000001,426
21671,RED SPOT CERAMIC DRAWER KNOB,8931,10762.47,568
84988,SET OF 72 PINK HEART PAPER DOILIES,7595,10729.4,618
35400,WOODEN BOX ADVENT CALENDAR ,1239,10710.1,331
47591D,PINK FAIRY CAKE CHILDRENS APRON,5839,10704.21,682
22667,RECIPE BOX RETROSPOT ,3841,10702.150000000001,645
21260,FIRST AID TIN,3370,10675.6,442
21428,SET3 BOOK BOX GREEN GINGHAM FLOWER ,2749,10667.05,363
22950,36 DOILIES VINTAGE CHRISTMAS,7744,10590.4,299
22649,STRAWBERRY FAIRY CAKE TEAPOT,2203,10577.95,410
21937,STRAWBERRY   PICNIC BAG,3801,10572.95,499
22616,PACK OF 12 LONDON TISSUES ,37084,10519.359999999999,633
22417,PACK OF 60 SPACEBOY CAKE CASES,20867,10465.49,911
22943,CHRISTMAS LIGHTS 10 VINTAGE BAUBLES,2258,10432.08,286
21210,SET OF 72 RETRO SPOT PAPER  DOILIES,7488,10423.199999999999,449
21844,RED RETROSPOT MUG,3787,10415.650000000001,297
22988,SOLDIERS EGG CUP ,9033,10415.22,349
21172,PARTY METAL SIGN ,7444,10392.72,804
22637,PIGGY BANK RETROSPOT ,4278,10377.02,496
21868,POTTING SHED TEA MUG,8770,10353.86,719
48185,DOOR MAT FAIRY CAKE,1640,10347.72,316
23209,LUNCH BAG VINTAGE DOILY ,6438,10347.66,538
21326,AGED GLASS SILVER T-LIGHT HOLDER,17004,10338.6,532
22580,ADVENT CALENDAR GINGHAM SACK,1785,10338.230000000001,388
23209,LUNCH BAG DOILEY PATTERN ,6477,10323.05,464
22109,FULL ENGLISH BREAKFAST PLATE,2872,10321.92,389
22768,FAMILY PHOTO FRAME CORNICE,1114,10310.19,320
21907,I'M ON HOLIDAY METAL SIGN,4990,10306.150000000001,694
22729,ALARM CLOCK BAKELIKE ORANGE,2797,10300.44,500
22488,NATURAL SLATE RECTANGLE CHALKBOARD,6453,10285.61,653
22508,DOORSTOP RETROSPOT HEART,2695,10283.5,577
21121,SET/10 RED POLKADOT PARTY CANDLES,8541,10238.49,438
22468,BABUSHKA LIGHTS STRING OF 10,1630,10229.64,335
22274,FELTCRAFT DOLL EMILY,3675,10227.310000000001,578
22663,JUMBO BAG DOLLY GIRL DESIGN,5367,10206.78,526
21210,SET OF 72 RETROSPOT PAPER  DOILIES,7259,10177.119999999999,482
23170,REGENCY TEA PLATE ROSES ,6563,10170.99,328
21524,DOOR MAT SPOTTY HOME SWEET HOME,1733,10121.69,256
22367,CHILDRENS APRON SPACEBOY DESIGN,5455,10120.289999999999,714
22302,COFFEE MUG PEARS  DESIGN,4808,10043.41,352
21624,VINTAGE UNION JACK DOORSTOP,1710,9987.98,350
22791,T-LIGHT GLASS FLUTED ANTIQUE,8698,9985.630000000001,332
20828,GLITTER BUTTERFLY CLIPS,4220,9951.0,499
23208,LUNCH BAG VINTAGE LEAF DESIGN,6191,9950.35,597
23300,GARDENERS KNEELING PAD CUP OF TEA ,6285,9933.69,635
21429,RED GINGHAM ROSE JEWELLERY BOX,5930,9907.5,764
21670,BLUE SPOT CERAMIC DRAWER KNOB,8061,9894.93,580
22418,10 COLOUR SPACEBOY PEN,11892,9878.1,472
48111,DOOR MAT 3 SMILEY CATS,1773,9861.69,246
84997C,CHILDRENS CUTLERY POLKADOT BLUE,2523,9827.25,211
21833,CAMOUFLAGE LED TORCH,5931,9797.310000000001,337
21982,PACK OF 12 SUKI TISSUES ,31340,9774.279999999999,521
22620,4 TRADITIONAL SPINNING TOPS,7559,9763.68,654
22834,HAND WARMER BABUSHKA DESIGN,6378,9747.83,479
23343,JUMBO BAG VINTAGE CHRISTMAS ,4905,9742.1,385
22900, SET 2 TEA TOWELS I LOVE LONDON ,3511,9726.85,331
48194,DOOR MAT HEARTS,1654,9715.06,281
23076,ICE CREAM SUNDAE LIP GLOSS,7896,9638.16,248
21922,UNION STRIPE WITH FRINGE  HAMMOCK,1280,9624.04,330
84997B,CHILDRENS CUTLERY RETROSPOT RED ,2492,9603.68,229
22970,LONDON BUS COFFEE MUG,4213,9582.15,276
21257,VICTORIAN SEWING BOX MEDIUM,1267,9550.49,360
21086,SET/6 RED SPOTTY PAPER CUPS,15834,9513.300000000001,621
16014,SMALL CHINESE STYLE SCISSOR,29354,9512.68,92
22966,GINGERBREAD MAN COOKIE CUTTER,7946,9497.91,610
22795,SWEETHEART RECIPE BOOK STAND,1465,9465.55,402
22968,ROSE COTTAGE KEEPSAKE BOX ,1036,9409.199999999999,243
21216,"SET 3 RETROSPOT TEA,COFFEE,SUGAR",2061,9376.67,283
21974,SET OF 36 PAISLEY FLOWER DOILIES,6652,9374.96,557
20829,GLITTER HANGING BUTTERFLY STRING,4700,9350.390000000001,404
21890,S/6 WOODEN SKITTLES IN COTTON BAG,3296,9347.16,411
48184,DOOR MAT ENGLISH ROSE ,1445,9343.43,291
84792,ENCHANTED BIRD COATHANGER 5 HOOK,2201,9326.33,437
22064,PINK DOUGHNUT TRINKET POT ,6214,9302.1,479
22656,VINTAGE BLUE KITCHEN CABINET,45,9290.0,37
85099B,RED RETROSPOT JUMBO BAG ,5333,9289.35,183
22120,WELCOME  WOODEN BLOCK LETTERS,967,9289.2,316
22740,POLKADOT PEN,11303,9276.83,180
23240,SET OF 4 KNICK KNACK TINS DOILY ,2286,9237.3,312
22668,PINK BABY BUNTING,3290,9236.86,381
84880,WHITE WIRE EGG HOLDER,1668,9227.800000000001,327
84997D,PINK 3 PIECE POLKADOT CUTLERY SET,2558,9227.380000000001,253
22840,ROUND CAKE TIN VINTAGE RED,1233,9211.630000000001,367
23171,REGENCY TEA PLATE GREEN ,5966,9184.9,270
22978,PANTRY ROLLING PIN,2406,9180.53,197
21756,BATH BUILDING BLOCK WORD,1543,9164.78,519
22694,WICKER STAR ,4428,9115.800000000001,720
22904,CALENDAR PAPER CUT DESIGN,3195,9110.29,398
85014A,BLACK/BLUE POLKADOT UMBRELLA,1622,9085.49,357
82552,WASHROOM METAL SIGN,6746,9080.01,654
22380,TOY TIDY SPACEBOY  ,4654,9044.0,549
22767,TRIPLE PHOTO FRAME CORNICE ,977,9035.63,279
22300,COFFEE MUG DOG + BALL DESIGN,3923,9021.390000000001,411
22198,LARGE POPCORN HOLDER ,5700,9006.2,411
23175,REGENCY MILK JUG PINK ,3062,8995.0,272
22179,SET 10 LIGHTS NIGHT OWL,1400,8990.8,300
21745,GAOLERS KEYS DECORATIVE GARDEN ,2670,8980.54,460
21735,TWO DOOR CURIO CABINET,765,8960.1,202
22992,REVOLVER WOODEN RULER ,4914,8944.439999999999,285
22942,CHRISTMAS LIGHTS 10 SANTAS ,1181,8912.95,217
22429,ENAMEL MEASURING JUG CREAM,2149,8867.29,526
85232B,SET/3 RUSSIAN DOLL STACKING TINS,1866,8864.300000000001,301
47570B,TEA TIME TABLE CLOTH,928,8852.880000000001,188
22131,FOOD CONTAINER SET 3 LOVE HEART ,4965,8846.17,496
22089,PAPER BUNTING VINTAGE PAISLEY,3196,8842.150000000001,421
82001S,VINYL RECORD FRAME SILVER,2550,8831.2,177
21892,TRADITIONAL WOODEN CATCH CUP GAME ,7273,8814.42,601
22549,PICTURE DOMINOES,6222,8813.74,540
20970,PINK FLORAL FELTCRAFT SHOULDER BAG,2403,8796.77,504
22144,CHRISTMAS CRAFT LITTLE FRIENDS,4289,8790.7,535
22741,FUNKY DIVA PEN,10297,8672.109999999999,196
21035,SET/2 RED RETROSPOT TEA TOWELS ,3001,8670.71,292
21558,SKULL LUNCH BOX WITH CUTLERY ,3630,8643.6,490
21781,MA CAMPAGNE CUTLERY BOX,595,8609.25,314
22381,TOY TIDY PINK POLKADOT,4378,8587.48,381
