StockCode,Description,TotalQuantitySold,Revenue,OrderCount
47503H,ASS FLORAL PRINT SPIRIT LEVEL ,147,191.53,48
90030B,RED KUKUI COCONUT SEED NECKLACE,122,191.3,19
90196B,BLACK GEMSTONE NECKLACE 45CM,15,191.25,10
35962,SET/12 ZINC CHRISTMAS DECORATIONS,91,191.10000000000002,15
22841,"CAKE TIN, ROUND, VINTAGE MINT,IVORY",27,190.65,4
71028B,SILVER BLUE EGG T-LIGHT HOLDER,483,189.89,8
23229,DONKEY TAIL GAME ,54,189.54000000000002,4
21400,RED PUDDING SPOON,1027,189.54,63
79303D,LILAC FLOWER BLOCK TABLE LAMP,64,188.8,7
90122C,TURQUOISE CRYSTAL+GLASS BRACELET,38,188.1,15
20837,FRENCH FLORAL CUSHION COVER ,165,188.07000000000002,18
21460,GREEN EASTER EGG HUNT START POST,96,187.2,20
90016B,GOLD/M.O.P PENDANT ORBIT NECKLACE,22,187.0,17
90185B,AMETHYST DIAMANTE EXPANDABLE RING,44,187.0,13
21543,BUTTERFLY WATER TRANSFER TATTOOS ,267,186.95,13
84893,ANT WHITE IRON BASKET,33,186.35000000000002,15
23436,GIFT BAG LARGE VINTAGE CHRISTMAS,148,185.0,9
84803A,PINK ALLIUM  ARTIFICIAL FLOWER,109,184.21,16
84744,S/6 SEW ON CROCHET FLOWERS,147,183.75,29
84509C,SET OF 4 DOTTY PLACEMATS ,54,183.3,13
90035A,"PEARL & SHELL 42""NECKL. GREEN",17,182.75,9
17090A,LAVENDER INCENSE 40 CONES IN TIN,173,182.65,26
16053,POPART COL BALLPOINT PEN ASST,4298,182.58,8
35819B,"ACRYLIC HANGING JEWEL,BLUE",381,182.19,29
72799D,BLUE PILLAR CANDLE SILVER FLOCK,65,182.15,13
85128,PLANTPOT SINGLE HOOK PISTACHIO,165,182.09,2
37379B,BLUE CHERRY BLOSSOM CUP & SAUCER,1122,181.5,3
22545,MINI JIGSAW BUNNIES AT HOME,432,181.44,9
84962,SET/3 COLOUR PAINTED KASHMIRI STOOL,3,179.85000000000002,2
84509E,SET OF 4 CAROUSEL PLACEMATS ,131,179.81,10
90210A,GREY ACRYLIC FACETED BANGLE,78,179.70000000000002,12
23697,A PRETTY THANK YOU CARD,438,179.64000000000001,26
84464,S/60 PINK FLUFFY CHICKS IN BOX,82,179.1,11
16043,POP ART PUSH DOWN RUBBER ,2142,179.04000000000002,12
90029,NEW BAROQUE SMALL NECKLACE BLACK,21,178.5,10
90122A,PINK CRYSTAL+GLASS BRACELET,36,178.20000000000002,14
23126,DOLLCRAFT GIRL AMELIE,36,178.2,8
84985B,SET OF 72 BLACK PAPER DOILIES ,122,176.89999999999998,19
22839,"CAKE TIN, 3 TIER MINT/IVORY",13,176.75,4
35838A,S/6 MULTICOLOUR ORNAMENETAL CANDLE,171,176.75,18
22384,LUNCHBAG PINK RETROSPOT,107,176.54999999999998,13
84966A,PINK KASHMIRI BOXED MIRROR,12,176.0,3
21018,BIRD BOX CHRISTMAS TREE DECORATION,207,175.95,37
84509C,DOTTY PLACEMATS ,52,175.8,9
21370,MIRRORED WALL ART FOXY,48,175.35,16
90036C,"FLOWER GLASS GARLAND NECKL.36""BLUE",22,174.9,8
35793,S/3 PUPPIES CHRISTMAS DECORATIONS,101,174.05,8
84877D,BLUE ROUND COMPACT MIRROR,101,173.75,15
17084P,DRAGONS BLOOD INCENSE,874,173.54,26
75011,BLUE DAISY MOBILE,181,172.51,15
90210C,RED   ACRYLIC FACETED BANGLE,113,171.95000000000002,9
21368,MIRRORED WALL ART LADIES,193,171.75,39
22345,PARTY PIZZA DISH BLUE RETROSPOT,202,171.7,24
84706C,PINK FLOCK TABLE CLOCK ,84,170.8,4
84706B,FAIRY CAKES TABLE CLOCK,19,170.04999999999998,8
47347B,BLUE FLOWER T-LIGHT HOLDER,236,169.72,7
90014B,GOLD M PEARL  ORBIT NECKLACE,17,169.14999999999998,13
35818B,"ACRYLIC JEWEL ICICLE, BLUE",403,168.38,8
90122B,JADE CRYSTAL+GLASS BRACELET,34,168.3,14
85205A,IVORY FELT EASTER RABBIT GARLAND,66,168.29999999999998,21
79403,FROSTED WHITE BASE ,197,167.45,23
90178B,PURPLE CHUNKY GLASS+BEAD NECKLACE,14,167.29999999999998,9
90036A,FLOWER GARLAND NECKLACE RED,21,166.95000000000002,14
22330,72 ROUND PINK DOILIES,115,166.75,15
37506,NEW ENGLAND MILK JUG W GIFT BOX,28,166.6,22
90119,METALIC LEAVES BAG CHARMS,67,166.17,18
21102,"CANDLE IN JAR COLLAGE , VANILLA",65,165.75,12
21394,RED SPOTTY BEAKER ,85,165.75,16
21530,DAIRY MAID CERAMIC TOASTRACK,56,165.20000000000002,16
84526,GIANT BLACK SUNGLASSES,84,163.79999999999998,31
90159,COTE D'AZURE NECKLACE,33,163.35,15
85024C,PINK SMALL JEWELLED PHOTOFRAME,99,163.35,42
35809B,ENAMEL BLUE RIM TEA CONTAINER,81,162.48,22
16207A,PINK STRAWBERRY HANDBAG ,55,162.25000000000003,19
84529A,PINK KNITTED KIDS RUCKSACK,24,162.0,10
72801C,S/4 ROSE PINK DINNER CANDLES,165,161.85,25
90040B,MURANO STYLE GLASS BRACELET BLACK,46,161.0,17
22889,NUMBER TILE VINTAGE FONT No ,145,160.38,8
23305,SET 4 PICNIC CUTLERY BLUEBERRY,82,159.9,9
22645,CERAMIC HEART CAKE MONEY BANK,120,159.6,5
85185C,COW  SOCK PUPPET,54,159.3,26
90162B,ANT SILVER LIME GREEN BOUDICCA RING,54,159.3,19
85165,CANDY PINK FRENCH BOUDOIR CLOCK,16,159.2,11
90125A,PINK BERTIE GLASS BEAD BAG CHARM,140,159.0,12
22864,MUG AND COASTER SET RED CIRCLES,378,158.76,2
90019A,SILVER M.O.P ORBIT BRACELET,32,158.4,17
21193,WHITE HONEYCOMB PAPER FAN ,84,158.36,14
16012,FOOD/DRINK SPUNGE STICKERS,759,158.19,20
22853,ENAMEL CAT BOWL CREAM,52,157.8,3
16156L,WRAP CAROUSEL,375,157.5,14
23545,WRAP RED DOILEY,375,157.5,15
90155,RESIN NECKLACE W PASTEL BEADS,21,157.5,12
10123G,ARMY CAMO WRAPPING TAPE,2246,157.18,12
16054,POPART RECT PENCIL SHARPENER ASST,1205,156.9,37
23143,ZINC WIRE KITCHEN ORGANISER,25,156.8,12
79030D,TUMBLER BAROQUE,402,156.78,25
23468,TUSCAN VILLA BIRD TABLE ,19,156.75,11
17178,FLAT PALM T-LIGHT HOLDER,133,156.65,24
84926C,FAIRY CAKES TILE COASTER,125,156.25,19
84531B,BLUE KNITTED EGG COSY,187,155.60999999999999,38
85123A,CREAM HANGING HEART T-LIGHT HOLDER,57,155.35,7
23416,CHAMBRE HOOK,123,155.07,18
21031,SPACE CADET BLACK,126,154.91,25
22587,"FELTCRAFT HAIRBAND, S/2, RED/BLUE",204,154.68,6
82585,SWEET VALENCIA CANDLE+CUP,131,154.63,21
90013A,MIDNIGHT BLUE VINTAGE EARRINGS,41,153.75,10
84855,BLOKEY SILVER TOOL SET,31,153.45000000000002,11
72140E,BEST DAD CANDLE LETTERS,216,153.35999999999999,27
84029D,LEOPARD PRINT HOT WATER BOTTLE,46,153.3,12
90063A,WHITE VINT ART DECO CRYSTAL NECKLAC,18,153.0,10
90185A,AMBER DIAMANTE EXPANDABLE RING,36,153.0,9
21226,POCKET MIRROR WOODLAND,122,152.5,20
22289,HANGING METAL CHICKEN DECORATION,122,152.5,19
23484,HEART TRELLISTRIPLE T-LIGHT HOLDER,56,152.24,5
48175,DOOR MAT CAMOUFLAGE,38,152.0,1
72801D,S/4 SKY BLUE DINNER CANDLES,157,151.85,25
84531A,PINK KNITTED EGG COSY,181,151.70999999999998,38
22536,MAGIC DRAWING SLATE FIDO,360,151.2,8
16202E,BLACK PHOTO ALBUM ,81,150.6,13
79161A,ST GEORGE SET OF 10 PARTY LIGHTS,51,150.45000000000002,16
90098,NECKLACE+BRACELET PINK BUTTERFLY,59,150.45,23
17107D,FLOWER FAIRY 5 DRAWER LINERS,59,150.45,20
90093,CLEAR CRYSTAL STAR PHONE CHARM,200,150.44,18
21461,BLUE EASTER EGG HUNT START POST,77,150.15,19
82093,HEART SHAPE BUTTON FRAME ,100,150.0,7
17011A,ORIGAMI VANILLA INCENSE+FLOWER ,254,150.0,6
21310,CAPIZ CHANDELIER,5,149.75,3
84452,METAL RABBIT LADDER EASTER ,176,149.6,26
23256,KIDS CUTLERY SPACEBOY ,36,149.4,8
23254,KIDS CUTLERY DOLLY GIRL ,36,149.4,8
23196,RETRO LEAVES MAGNETIC NOTEPAD,103,149.35,17
17108D,FLOWER FAIRY SUMMER BOUQUET SACHET,355,149.1,23
90000D,COPPER/OLIVE GREEN FLOWER NECKLACE,25,148.75,13
90000A,RASPBERRY ANT COPPER FLOWER NECKLAC,25,148.75,14
90016A,SILVER/M.O.P PENDANT ORBIT NECKLACE,22,148.75,9
40001, WHITE BAMBOO RIBS LAMPSHADE,210,148.26,7
90129C,GREEN GLASS TASSLE BAG CHARM,50,147.5,17
84720,DOT MATRIX CANVAS ART PICTURE,35,147.05,3
84510C,SET OF 4 POLKADOT COASTERS,115,146.17,38
20796,SMALL BLUE PROVENCAL CERAMIC BALL,88,145.2,13
20672,PINK TEATIME PRINT BOWL,116,145.0,22
84313A,PINK TV TRAY TABLE ,34,144.5,16
47518F,ICON PLACEMAT POP ART ELVIS,900,144.3,31
35610B,BLACK CHRISTMAS FLOCK DROPLET ,179,144.07,13
85095,THREE CANVAS LUGGAGE TAGS,90,143.85999999999999,11
90048,GREEN WITH METAL BAG CHARM,29,143.55,6
47591A,CAROUSEL DES CHILD'S APRON,87,143.54999999999998,33
23292,SPACE BOY CHILDRENS CUP,130,143.3,5
84564,6 SEGMENT COLOURED SNACK BOWL ,18,143.1,9
21353,SILVER SLEIGHBELL  WREATH,18,143.1,8
90036E,"FLOWER GLASS GARLD NECKL36""AMETHYST",18,143.1,11
82587,TEXRIO TOMATOES CANDLE+CUP,118,142.94,32
90123B,TURQUOISE HEART OF GLASS BRACELET,24,142.8,11
90123C,GREEN HEART OF GLASS BRACELET,24,142.8,9
84877A,PINK ROUND COMPACT MIRROR,46,142.5,14
22510,DOORSTOP RUSSIAN DOLL GINGHAM,38,142.5,22
35980C,REDWHITE STRIPE SCANDINAVIAN HEART ,375,142.5,28
82553,POP'S GREASY SPOON METAL SIGN,86,141.9,20
23694,PAISLEY PARK CARD,348,141.84,24
37422,WHITE WITH BLACK CATS BOWL,344,141.68,27
90186A,AMETHYST HOOP EARRING FLORAL LEAF,48,141.60000000000002,15
90018A,SILVER M.O.P ORBIT DROP EARRINGS,33,140.25,16
21003,ROSE DU SUD CUSHION COVER,22,139.7,11
23091,METAL HERB GERDEN CONTAINER,24,139.68,5
90124C,GREEN MURANO TWIST NECKLACE,14,139.29999999999998,8
90180B,PURPLE AMETHYST NECKLACE W TASSEL,14,139.29999999999998,10
20968,GREEN FLORAL FELTCRAFT SHOULDER BAG,37,138.75,14
84247E,PACK OF 12 CHRISTMAS FUN CARDS,47,138.65,13
22195,HEART MEASURING SPOONS LARGE,84,138.6,5
23304,SET 4 PICNIC CUTLERY CHERRY ,71,138.45,9
90086,CRYSTAL FROG PHONE CHARM,189,138.32999999999998,19
23417,BATHROOM HOOK,140,137.76,21
72754B,F FAIRY POTPOURRI CUSHIONS LAVENDER,170,137.54,8
90123D,WHITE HEART OF GLASS BRACELET,23,136.85000000000002,8
85026B,EAU DE NILE JEWELLED T-LIGHT HOLDER,161,136.85,20
22869,NUMBER TILE COTTAGE GARDEN 1,70,136.5,20
35824P,"HANGING FLOWERS+MIRROR,PINK",324,136.44,3
10120,DOGGY RUBBER,648,136.07999999999998,62
90214A,"LETTER ""A"" BLING KEY RING",127,135.71,45
90036B,"FLOWER GLASS GARLAND NECKL.36""GREEN",17,135.15,9
90002A,FLOWER BURST SILVER RING OPAL,36,135.0,14
20952,PORCELAIN CHERUB BELL SMALL,321,134.82,20
22870,NUMBER TILE COTTAGE GARDEN 2,69,134.54999999999998,17
21157,RED RETROSPOT WASHBAG,64,134.4,17
90081C,LILY BROOCH OLIVE COLOUR,27,133.65,13
84231,EASTER BUNNY WITH BASKET ON BACK,204,132.6,34
79192A,RETRO PLASTIC 70'S TRAY,106,132.5,30
84510C,SET OF 4 POLKADOTS COASTERS,109,132.45,29
23081,GREEN METAL BOX TOP SECRET,16,132.0,4
23066,SMALL JEWELLERY STAND,16,132.0,6
45013,FOLDING SHOE TIDY,48,132.0,8
23465,TUSCAN VILLA BIRD FEEDER,16,132.0,8
22344,PARTY PIZZA DISH PINK RETROSPOT,155,131.75,19
37467,PIG MUG IN TWO COLOUR DESIGNS,212,131.44,28
77079,DOLPHIN WINDMILL,62,131.44,11
82011A,"BATHROOM SCALES, TROPICAL BEACH",35,131.25,23
90013C,GREEN VINTAGE EARRINGS ,35,131.25,10
90003D,CRYSTAL PAIR HEART HAIR SLIDES,35,131.25,15
48179,DOOR MAT SWEET HOME,28,131.25,6
84527,FLAMES SUNGLASSES PINK LENSES,71,131.25,19
84555A,YELLOW VW BEETLE CERAMIC MONEY BOX,46,130.9,15
84925E,FLOWERS WALL THERMOMETER,75,130.05,3
20899,VINTAGE NOTEBOOK RED ROSE,44,129.8,12
17011D,ORIGAMI ROSE INCENSE+FLOWER,207,129.3,2
22241,"GARLAND , WOODEN  "" HAPPY EASTER""",103,128.75,9
20821,GOLDIE LOOKING MIRROR,26,128.70000000000002,10
84874B,BLUE TRAVEL FIRST AID KIT,78,128.7,28
37330,BIG POLKADOT MUG,78,128.33999999999997,5
16119,FUNKY GIRL ADDRESS BOOK,271,128.21,7
90175B,PINK GLASS CHUNKY CHARM BRACELET,15,127.8,7
72812,LARGE ZINC GLASS CANDLEHOLDER,55,127.68,10
22848,"BREAD BIN, DINER STYLE, PINK",8,127.6,3
90013D,PURPLE VINTAGE EARRINGS,34,127.5,8
84782B,BLACK 3 TIER GLASS PLATE STAND,10,127.5,6
90063B,BLACK VINT ART DEC CRYSTAL NECKLACE,15,127.5,9
85018C,S/6 PAPER BOXES CURIOUS IMAGES ,36,127.2,4
46137D,GREEN CHENILLE SHAGGY RUG,43,126.85,3
85179C,PINK BITTY LIGHT CHAIN,77,126.85,10
23303,SET 4 PICNIC CUTLERY FONDANT,65,126.75,6
23020,GLASS SONGBIRD STORAGE JAR,11,126.7,3
82607E,GLASS BONBON JAR. D'AMANDES,101,126.25,25
47593B,SCOTTIES DESIGN BABY BIB,101,126.25,17
84255B,ORANGE COCKTAIL GLASS LAMP,60,126.00000000000001,14
22882,NUMBER TILE VINTAGE FONT 3,91,125.89,25
23065,LARGE JEWELLERY STAND,10,125.0,4
84709A,SILVER OVAL JEWELLED MIRROR,21,124.95,11
84622,PINK GINGHAM ROSE CUSHION COVER,21,124.95,7
35816P,"ACRYLIC JEWEL ANGEL,PINK",292,124.88,7
10080,GROOVY CACTUS INFLATABLE,303,124.60999999999999,26
84661C,PINK SQUARE TABLE CLOCK,137,124.55000000000001,12
71496A,A4 WALL TIDY BLUE OFFICE,228,124.44000000000001,8
90125D,PURPLE BERTIE GLASS BEAD BAG CHARM,102,124.2,11
84927A,WAKE UP COCKEREL TILE HOOK,218,124.17,25
90162C,ANT SILVER FUSCHIA BOUDICCA RING,42,123.90000000000002,16
22359,"GLASS JAR, KINGS CHOICE SOAP",42,123.9,8
85185B,PINK HORSE SOCK PUPPET KIT,42,123.9,14
35015,JACOBS LADDER SMALL,2064,123.84,38
17191A,ROSE FLOWER CANDLE+INCENSE 16X16CM,33,123.75,12
20816,GOLD FLOWER CUSHION COVER ,24,123.6,7
22850,BREAD BIN DINER STYLE BLACK,8,123.6,1
84228,HEN HOUSE W CHICK STANDING,308,123.36,20
84559D,3D SHEET OF SEA WORLD STICKERS,145,123.25,29
21087,SET/6 POSIES PAPER CUPS,220,123.22,20
23454,SET OF 3 MINI HANGING PORTRAITS,32,123.2,2
23457,LARGE PARLOUR FRAME,27,122.85,2
22869,"NUMBER TILE COTTAGE GARDEN, 1",63,122.85,7
22832,SWEETHEART WIRE WALL TIDY,12,122.6,3
84367,LA STREGA CANVAS PICTURE ,73,122.55000000000001,7
79308B,MOSAIC CANDLE DISH BLUE PURPLE,144,122.4,2
16168S,FUNKY MONKEY GIFT BAG SMALL,1274,121.86,7
79532,MOSAIC GLASS BALL CANDLEHOLDER,97,121.25,18
22535,MAGIC SLATE BUNNIES AT HOME ,288,120.96000000000001,6
22536,MAGIC SLATE FIDO,288,120.96000000000001,6
22534,MAGIC SLATE SPACEBOY ,288,120.96000000000001,6
23438,GIFT BAG LARGE SPOT ,96,120.0,6
85166A,WHITE METAL BAROQUE PHOTO FRAME,72,120.0,8
84509F,NEW ENGLAND PLACEMATS,32,120.0,10
35911B,PINK/FLOWER RABBIT EGG WARMER ,57,119.7,13
23463,VINTAGE ZINC WATERING CAN,12,119.39999999999999,7
90151,SILVER/NATURAL SHELL NECKLACE,14,119.0,7
84656,WHITE ROSE C/COVER,20,119.0,12
23359,SET OF 12 T-LIGHTS VINTAGE DOILEY,61,118.94999999999999,6
23280,FOLDING MIRROR HOT PINK ,156,118.92000000000002,5
22972,CHILDRENS SPACEBOY MUG,72,118.80000000000001,5
21228,"POCKET MIRROR ""GLAMOROUS""",95,118.75,29
84872A,TEATIME FUNKY FLOWER BACKPACK FOR 2,7,118.65,6
35933,PINK STOCKING CHRISTMAS DECORATION,312,118.56,23
44242B,PINK FEATHERS CURTAIN,106,117.78,8
90214C,"LETTER ""C"" BLING KEY RING",114,117.53999999999999,35
35824C,"HANGING FLOWERS+MIRROR,CLEAR",235,117.05,8
23244,STORAGE TIN VINTAGE LEAF,60,117.0,7
22877,NUMBER TILE COTTAGE GARDEN 9,60,117.0,16
47593A,CAROUSEL PONIES BABY BIB,115,116.87,28
84858A,NATURAL RIVIERA HANDBAG,52,116.7,7
72038P,PRICE'S CANDLE PEACH,1050,116.5,9
16206B,RED PURSE WITH PINK HEART,96,116.4,16
90144,SILVER DROP EARRINGS WITH FLOWER,31,116.25,11
84751B,BLACK MEDIUM GLASS CAKE STAND,38,115.86,19
90030C,BROWN KUKUI COCONUT SEED NECKLACE,81,115.65,10
23209,LUNCH BAG VINTAGE DOILEY ,70,115.5,4
22878,NUMBER TILE COTTAGE GARDEN No,55,115.5,13
20848,ZINC HEART LATTICE CHARGER SMALL,39,115.05000000000001,12
22872,NUMBER TILE COTTAGE GARDEN 4,59,115.05,16
23185,FRENCH STYLE STORAGE JAR JAM,317,114.85,30
90214S,"LETTER ""S"" BLING KEY RING",111,114.75,35
90065A,WHITE VINTAGE CRYSTAL BRACELET,17,114.75,7
22885,NUMBER TILE VINTAGE FONT 6 ,85,114.19,16
23535,WALL ART BICYCLE SAFTEY ,21,114.15,3
46776D,WOVEN SUNSET CUSHION COVER ,23,113.85,9
22877,"NUMBER TILE COTTAGE GARDEN, 9",58,113.1,4
22874,NUMBER TILE COTTAGE GARDEN 6,58,113.1,15
85190,PINK FLOWER HANGING HEART ,133,113.05,14
82607C,GLASS BONBON JAR. SUPERFINES,90,112.5,21
84462,3 PINK HEN+CHICKS IN BASKET,99,112.35,13
44236,PINK/PURPLE CIRCLE CURTAIN,64,112.32000000000001,12
90214K,"LETTER ""K"" BLING KEY RING",109,112.25,45
20896,VINTAGE NOTEBOOK PINK FLOWER,38,112.10000000000001,13
71510,SQUARE METAL CANDLEHOLDER BASE,177,112.05,17
17014A,ORIGAMI VANILLA INCENSE CONES,247,111.81,9
21412,VINTAGE GOLD TINSEL REEL,233,111.3,42
84288B,SET/2 BLUE  NOODLE BASKETS,57,111.14999999999999,21
22873,"NUMBER TILE COTTAGE GARDEN, 5",57,111.14999999999999,3
84493,BLUE/PINK NEST STRIPE BOX,1142,111.12,5
90170,DAISY HAIR BAND,67,110.55000000000001,10
90024D,NEW BAROQUE B'FLY NECKLACE PINK,13,110.5,11
20693,FLORAL DINOSAUR GREEN,26,110.5,12
21004,ROSE DU SUD CHILDRENS APRON,26,110.5,15
23496,PANTRY KITCHEN THERMOMETER ,88,110.0,22
78026,SEAGRASS S/3 SQU LAUNDRY BOX,11,110.0,1
84886,BLUE METAL WALL SHELF,11,109.44999999999999,8
23578,SNACK TRAY RED GINGHAM,56,109.2,11
22875,"NUMBER TILE COTTAGE GARDEN, 7",56,109.19999999999999,2
22876,"NUMBER TILE COTTAGE GARDEN, 8",56,109.19999999999999,2
22870,"NUMBER TILE COTTAGE GARDEN, 2",56,109.19999999999999,2
22871,"NUMBER TILE COTTAGE GARDEN, 3 ",56,109.19999999999999,2
22868,"NUMBER TILE COTTAGE GARDEN, 0 ",56,109.19999999999999,2
22872,"NUMBER TILE COTTAGE GARDEN, 4",56,109.19999999999999,2
22874,"NUMBER TILE COTTAGE GARDEN, 6",56,109.19999999999999,2
72134,COLUMBIAN  CUBE CANDLE ,320,109.16,20
90129D,AMBER GLASS TASSLE BAG CHARM,37,109.15000000000002,12
90129E,PURPLE GLASS TASSLE BAG CHARM,37,109.15,10
90158,ST TROPEZ NECKLACE,22,108.9,11
90073,VINTAGE ENAMEL & CRYSTAL EARRINGS,22,108.9,7
90173,PAIR BUTTERFLY HAIR CLIPS,29,108.75,7
90199B,5 STRAND GLASS NECKLACE AMETHYST,17,107.94999999999999,12
90214L,"LETTER ""L"" BLING KEY RING",114,107.94,29
23041,PAPER LANTERN 6 POINT SNOW STAR,26,107.9,6
84899F,YELLOW PURPLE DAISY FELT PURSE KIT,86,107.5,23
22868,NUMBER TILE COTTAGE GARDEN 0 ,55,107.25,12
23455,SMALL PARLOUR FRAME,42,106.98000000000002,2
48103,DOORMAT KISS MY.......,22,106.58,2
22135,MINI LADLE LOVE HEART PINK,242,106.56,45
71495B,CD WALL TIDY RED FLOWERS,288,106.56,12
22881,NUMBER TILE VINTAGE FONT 2,81,106.39,14
23477,WOODLAND LARGE BLUE FELT HEART,85,106.25,8
90194,SILVER LARIAT BLACK STONE EARRINGS,25,106.25,14
22445,PENCIL CASE GINGHAM FOREST,36,106.20000000000002,4
90186B,CRYSTAL HOOP EARRING FLORAL LEAF,36,106.20000000000002,13
90108,BLUE BLOSSOM HAIR CLIP,101,106.05,13
22875,NUMBER TILE COTTAGE GARDEN 7,54,105.3,16
22433,WATERING CAN PINK BUNNY,54,105.3,5
17090D,VANILLA INCENSE 40 CONES IN TIN,88,105.2,28
79144B,PAINTED LIGHTBULB STAR+ MOON,259,105.17999999999999,40
16169D,WRAP WINTER FOREST,250,105.0,9
23574,PACKING CHARGE,14,105.0,14
84199,GLOW IN DARK DOLPHINS,511,104.79,62
84458,S/3 RABBIT FLOWER/EGG/CARROT ROPE,123,104.55,19
23151,ZINC SWEETHEART SOAP DISH,59,104.41,19
21118,SHOPPING BAG DOORSTOP,69,104.25,7
20698,LITTLE PINK MONSTER SOFT TOY,43,104.25,18
90049,IVORY GOLD METAL BAG CHARM,19,104.07,5
90206C,CRYSTAL DIAMANTE STAR BROOCH,21,103.95,11
84705B,FAIRY CAKES PHOTO FRAME,83,103.75,2
10138,ASSORTED COLOUR JUMBO PEN,247,103.74,16
35607A,PINK FLUFFY CHRISTMAS DECORATION,545,103.55,28
90036F,"FLOWER GLASS GARLD NECKL36""TURQUOIS",13,103.35000000000001,4
84679,CLASSICAL ROSE TABLE LAMP,14,103.3,4
85185F,LION SOCK PUPPET,35,103.25000000000001,17
84247H,PACK/12 DECOUPAGE CARD,35,103.25000000000001,14
90129F,RED GLASS TASSLE BAG CHARM,35,103.25000000000001,14
90129A,PINK GLASS TASSLE BAG CHARM ,35,103.25,15
72133,COLUMBIAN CANDLE RECTANGLE,99,102.87,27
35096B,RED VICTORIAN FABRIC HEART BOX,288,102.63,21
84613A,PINK NEW BAROQUE FLOCK CANDLESTICK,22,102.3,10
90024E,NEW BAROQUE B'FLY NECKLACE MONTANA,12,102.0,7
90030A,SPOTTED WHITE NATURAL SEED NECKLACE,77,101.75,8
84873A,FUNKY FLOWER PICNIC BAG FOR 4,6,101.69999999999999,5
84249A,"GREETING CARD,SQUARE, DOUGHNUTS",238,101.6,20
90040C,MURANO STYLE GLASS BRACELET GOLD,29,101.5,10
35910A,MULTICOLOUR EASTER RABBIT ,52,101.39999999999999,12
22871,NUMBER TILE COTTAGE GARDEN 3 ,52,101.39999999999999,10
22876,NUMBER TILE COTTAGE GARDEN 8,52,101.39999999999999,11
84921,CREAM AND PINK FLOWERS PONY ,27,101.25,14
16248B,BLUE HOLE PUNCH,81,101.25,12
90060F,FIRE POLISHED GLASS NECKL GREEN,17,101.15,7
21089,SET/6 GREEN SPRING PAPER CUPS,316,100.98,36
85050,FRENCH ENAMEL SOAP DISH WITH LID,48,100.8,1
84549,CROCHET WHITE RABBIT KEYRING ,64,100.8,9
72821,CUPID SCENTED CANDLE IN GLASS,61,100.65,14
22884,NUMBER TILE VINTAGE FONT 5,78,100.53999999999999,18
22883,NUMBER TILE VINTAGE FONT 4,78,100.53999999999999,11
75172,PAINTED SEA SHELL METAL WINDCHIME,97,100.31,11
90190B,GOLD/AMBER DROP EARRINGS W LEAF,34,100.30000000000001,6
72753C,S/3 FLWR FAIRY ROSE CANDLES,42,99.9,5
23466,TUSCAN VILLA DOVECOTE,12,99.0,4
23465,TUSCAN VILLA FEEDING STATION,12,99.0,7
22736,"RIBBON REEL, MAKING SNOWMEN ",60,99.0,5
23191,BUNDLE OF 3 RETRO EXERCISE BOOKS,60,99.0,5
84575A,PINK DOG CANNISTER,24,98.8,13
22873,NUMBER TILE COTTAGE GARDEN 5,50,97.5,15
16161G,WRAP BAD HAIR DAY,975,97.5,33
20957,PORCELAIN HANGING BELL SMALL,67,97.15,12
22812,PACK 3 BOXES CHRISTMAS PANETTONE,39,95.67,12
84951A,S/4 PISTACHIO LOVEBIRD COASTERS,68,95.39999999999999,5
17084J,LOVE POTION MASALA INCENSE,454,95.34,19
90199A,5 STRAND GLASS NECKLACE BLACK,15,95.25,9
90199D,5 STRAND GLASS NECKLACE AMBER,15,95.25,9
90211B,JET BLACK LAS VEGAS NECKLACE 45CM,16,95.2,8
48103,DOOR MAT KISS MY.......,13,95.15,8
84967A,PINK KASHMIRI OCCASIONAL TABLE,2,94.95,2
72606A,BROWN ANTIQUE CUBE CANDLE,226,94.92,18
90125C,TURQUOISE BERTIE GLASS BEAD CHARM,88,94.8,6
90214E,"LETTER ""E"" BLING KEY RING",95,94.75,33
72740A,LARGE STRAWBERRY CHOCOLATE CANDLE,56,94.7,5
20861,GOLD COSMETIC BAG PINK STAR,45,94.5,15
21241,GREEN POLKADOT CUP,111,94.35,10
90137,PINK COMBO MINI CRYSTALS NECKLACE,19,94.05000000000001,8
90003C,MIDNIGHT BLUE PAIR HEART HAIR SLIDE,25,93.75,10
47593A,CAROUSEL DESIGN BABY BIB,75,93.75,14
90002C,FLOWER BURST SILVER RING MIDN'T BLU,25,93.75,11
23402,HOME SWEEET HOME 3 PEG HANGER ,25,93.75,4
22432,WATERING CAN GREEN DINOSAUR,48,93.6,6
17084A,TRANQUILITY MASALA INCENSE,442,92.82,18
35610A,PINK CHRISTMAS FLOCK DROPLET ,138,92.82,8
22886,NUMBER TILE VINTAGE FONT 7,74,92.74,13
35966,FOLKART CHRISTMAS TREE T-LIGHT HOLD,244,92.72,20
47592B,SCOTTIES DESIGN CHILD'S OVERALL,44,92.4,17
84867A,PINK BABY GIRLS PHOTO ALBUM,15,92.25,3
21343,GOLD JEWELERY BOX,20,92.0,3
20697,LITTLE GREEN MONSTER SOFT TOY,38,91.49999999999999,19
90177D,DROP DIAMANTE EARRINGS PURPLE,31,91.45000000000002,10
20664,TROPICAL HOLIDAY PURSE ,31,91.45000000000002,16
23075,DOUBLE CERAMIC PARLOUR HOOK,22,91.30000000000001,5
90040D,MURANO STYLE GLASS BRACELET PINK,26,91.0,10
22880,NUMBER TILE VINTAGE FONT 1,73,90.78999999999999,13
22878,"NUMBER TILE COTTAGE GARDEN, No",43,90.3,3
90163A,PINK ROSEBUD & PEARL NECKLACE,12,90.0,5
90150,BLUE SHELL+SILVER NECKLACE,12,90.0,7
90003B,ROSE COLOUR PAIR HEART HAIR SLIDES,24,90.0,9
90214J,"LETTER ""J"" BLING KEY RING",81,89.73,30
17013C,ORIGAMI LAVENDER INCENSE IN TUBE,213,89.46000000000001,2
79191D,RETRO PLASTIC DAISY TRAY,105,89.25,31
90023,FILIGREE DIAMANTE EARRINGS,21,89.25,11
84765,SILVER ROCOCO CANDELABRA,7,89.25,4
90042C,FRESHWATER PEARL BRACELET IVORY,35,89.25,8
84437A,S/6 PINK EASTER DECS IN BOX,105,89.25,17
90156,RESIN BRACELET W PASTEL BEADS,18,89.10000000000001,7
90133,TEAL/FUSCHIA COL BEAD NECKLACE,18,89.1,7
84388,WISE MAN STAR SHAPE EGG PAN,70,89.03999999999999,22
20660,VIP LUGGAGE TAG ,71,88.75,26
21337,SILVER WASHBAG,30,88.50000000000001,9
84984D,ORIENTAL RED C/COVER ,20,88.2,5
35638A,PINK AND BLACK STRING CURTAIN,39,88.04999999999998,6
84721,MANHATTAN CANVAS ART PICTURE,20,87.8,2
90214M,"LETTER ""M"" BLING KEY RING",79,87.23,29
35822B,"ACRYLIC BEAD CHAIN, BLUE",229,87.02,1
90094,NECKLACE+BRACELET SET FRUIT SALAD ,34,86.69999999999999,21
71406C,BLACK ORANGE SQUEEZER,206,86.52,31
84424A,FOUR PICTURE WHITE GLASS FRAME,23,86.25,10
84465,15 PINK FLUFFY CHICKS IN BOX,29,85.55000000000001,20
90190C,SILVER/AMETHYST DROP EARRINGS LEAF,29,85.55000000000001,10
90162A,ANT SILVER TURQUOISE BOUDICCA RING,29,85.55000000000001,10
90164A,PINK ROSEBUD PEARL BRACELET,21,85.35,7
22844,"DOG FOOD CONTAINER , VINTAGE",10,85.0,3
90026D,GLASS BEAD HOOP NECKLACE AMETHYST,10,85.0,8
22887,NUMBER TILE VINTAGE FONT 8,70,84.94,13
17027A,INCENSE BAZAAR CANNABIS,228,84.84,2
46775B,BERRIES CHUNKY KNITTED THROW ,5,84.75,4
46775A,BUBBLE GUM CHUNKY KNITTED THROW ,5,84.75,4
35271S,GOLD PRINT PAPER BAG,414,84.17999999999999,18
90088,CRYSTAL KEY+LOCK PHONE CHARM,99,84.14999999999999,12
23456,MEDIUM PARLOUR FRAME ,22,84.1,2
72783,BLACK SIL'T SQU CANDLE PLATE ,40,84.0,7
90000B,MIDNIGHT BLUE COPPER FLOWER NECKLAC,14,83.30000000000001,9
23442,12 HANGING EGGS HAND PAINTED,40,83.2,7
37342,SPOTTY COFFEE CUP & SAUCER,28,82.60000000000001,6
90039D,FIRE POLISHED GLASS BRACELET GREEN,22,82.5,5
90069,RUBY GLASS CLUSTER NECKLACE,11,82.5,5
35838B,S/6 SILVER ORNAMENETAL CANDLE,97,82.45,22
35913B,WHITE/PINK CHICK EASTER DECORATION,97,82.45,19
21699,SET 5 MINI CHOCOLATE FRIDGE MAGNETS,108,82.44,3
16051,TEATIME PENCIL W STAMP ASST,938,82.2,3
35609A,PINK FEATHER CHRISTMAS DECORATION,427,82.19,18
22566,"FELTCRAFT HAIRBAND S/2, PINK/PURPLE",96,81.6,8
22579,WOODEN TREE CHRISTMAS SCANDISPOT,96,81.6,3
72779,SET/6 BLACK ROSE T-LIGHT CANDLES,48,81.12,15
16011, ANIMAL STICKERS,385,80.85,12
90121B,VINTAGE ROSE BEAD BRACELET BLUE,19,80.75,9
90164B,WHITE  ROSEBUD PEARL BRACELET,30,80.7,8
22531,MAGIC SLATE CIRCUS PARADE  ,192,80.64,4
22530,MAGIC SLATE DOLLY GIRL ,192,80.64,4
17011E,ORIGAMI OPIUM SCENT INCENSE+FLOWER,124,80.60000000000001,1
90040A,MURANO STYLE GLASS BRACELET RED,23,80.5,10
90166,PINK & WHITE ROSEBUD RING,19,80.15,11
23370,SET 36 COLOUR PENCILS DOILEY,64,80.0,3
47592A,CAROUSEL CHILDRENS OVERALL,38,79.8,4
84795E,RIO PINK STRIPE HAMMOCK,10,79.5,5
22649,STRAWBERRY CAKE TEAPOT,16,79.2,4
23464,VINTAGE ZINC WATERING CAN SMALL,16,79.2,6
90115,SUMMER BUTTERFLIES BAG CHARM,31,79.05,11
90096,NECKLACE+BRACELET SET BLUE BLOSSOM,31,79.05,11
37471,MULTICOLOUR POLKADOT PLATE,696,78.60000000000001,2
35931,PINK STAR CHRISTMAS DECORATION,156,78.11999999999999,15
84596I,WRAP SWEETS LIGHT PINK SMALL BOWL,71,78.11,9
35265,COLOURFUL FLOWER FRUIT BOWL,20,78.05,15
71495A,CD WALL TIDY BLUE OFFICE,213,77.94000000000001,9
84914A,PINK ROSE PICNIC RUG,3,77.85,2
23497,CLASSIC CROME BICYCLE BELL ,60,77.4,2
84614A,PINK BAROQUE FLOCK CANDLE HOLDER,13,77.35000000000001,7
21450,DISTRESSED CANDLE STICK WHITE,13,77.35,3
90092,BLUE CRYSTAL BOOT PHONE CHARM,91,77.35,7
22888,NUMBER TILE VINTAGE FONT 9 ,66,77.14,10
90183A,AMBER DROP EARRINGS W LONG BEADS,26,76.70000000000002,6
90202D,PINK ENAMEL FLOWER HAIR TIE,26,76.70000000000002,5
90162D,ANT SILVER PURPLE BOUDICCA RING,26,76.7,11
84923,PINK BUTTERFLY HANDBAG W BOBBLES,9,76.5,5
90024B,NEW BAROQUE B'FLY NECKLACE RED,9,76.5,6
90028,NEW BAROQUE LARGE NECKLACE BLK/WHIT,9,76.5,5
84617, NEW BAROQUE BLACK BOXES,6,76.5,3
35815P,"ACRYLIC JEWEL SNOWFLAKE, PINK",168,75.88,7
23467,VINTAGE ZINC PLANTER  ,23,75.66999999999999,5
62043B,BLUE CHECK BAG W HANDLE 34X20CM,54,75.16000000000001,10
23061,VINTAGE ENGRAVED HEART,60,75.0,4
84030C,KNITTED RAINBOW HOT WATER BOTTLE,20,75.0,5
90176D,DIAMANTE NECKLACE PURPLE,10,75.0,6
37399,"ASS RETROSPOOF MUGS,SPORTS",143,75.0,6
16161E,WRAP BOUDOIR ,750,75.0,9
90013B,BLACK VINTAGE EARRINGS,20,75.0,5
84757,ENCHANTED GARDEN WROUGHT IRON TABLE,5,74.75,4
23068,ALUMINIUM HEART,30,74.7,6
23044,PAPER LANTERN 9 POINT HOLLY STAR 23,18,74.7,5
90116,FRUIT SALAD BAG CHARM,44,74.36,11
46138B,BLUE CHENILLE SHAGGY CUSHION COVER ,59,74.35,19
