StockCode,Description,TotalQuantitySold,Revenue,OrderCount
21802,CHRISTMAS TREE HEART DECORATION,2388,1002.9599999999999,99
22678,FRENCH BLUE METAL DOOR SIGN 3,799,1001.18,113
84569D,PACK 6 HEART/ICE-CREAM PATCHES,799,1001.17,96
22258,FELT FARM ANIMAL RABBIT,1113,1000.77,71
85179B,WHITE BITTY LIGHT CHAIN ,240,1000.0799999999999,39
23347,I LOVE LONDON BEAKER,827,999.75,70
85169A,IVORY LOVE BIRD CANDLE,913,999.07,97
23087,ZINC  HEART T-LIGHT HOLDER,830,997.1800000000001,49
23131,MISELTOE HEART WREATH CREAM,240,996.0,1
23376,PACK OF 12 VINTAGE CHRISTMAS TISSUE,2630,995.4599999999999,113
23102,SILVER HEARTS TABLE DECORATION,1231,995.33,139
22049,WRAP CHRISTMAS SCREEN PRINT,3450,994.75,112
20832,RED FLOCK LOVE HEART PHOTO FRAME,1576,994.0999999999999,103
21145,ANTIQUE GLASS PLACE SETTING,839,994.03,39
85136C,RED SHARK HELICOPTER,125,993.75,80
22416,36 DOILIES SPACEBOY DESIGN ,705,993.4499999999999,52
23365,SET 12 COLOUR PENCILS LOVE LONDON,1529,991.45,128
23452,HEART MINI PORTRAIT FRAME,510,990.9,81
85212,MINI PAINTED GARDEN DECORATION ,2766,990.6199999999999,96
84964B,BLUE PAINTED KASHMIRI TABLE ,17,990.0,2
21399,BLUE POLKADOT COFFEE MUG,2113,989.9399999999999,70
21530,DAIRY MAID TOASTRACK,860,989.72,114
84678,CLASSICAL ROSE SMALL VASE,541,989.5500000000001,64
20752,BLUE POLKADOT WASHING UP GLOVES,471,989.1,156
84559A,3D SHEET OF DOG STICKERS,1161,987.63,151
17021,NAMASTE SWAGAT INCENSE,3714,982.44,75
22856,ASSORTED EASTER DECORATIONS  BELLS,872,980.5600000000001,27
85124C,GREEN JUICY FRUIT PHOTO FRAME,397,979.95,97
22323,PINK POLKADOT KIDS BAG,474,975.9,72
21202,DOLLY HONEYCOMB GARLAND,814,975.9,56
37424,WHITE WITH BLACK CATS MUG,5153,975.41,47
72815,3 WICK CHRISTMAS BRIAR CANDLE ,260,975.0,59
22260,FELT EGG COSY BLUE RABBIT ,1187,973.0699999999999,108
21752,GLASS CAKE STAND MIRRORED BASE,68,972.6,30
20705,MRS ROBOT SOFT TOY,269,972.5500000000001,49
20866,BLUE ROSE FABRIC MIRROR,963,972.29,87
23041,PAPER LANTERN 9 POINT SNOW STAR,234,971.1,42
20784,RED RETRO BAR STOOL,26,970.7,8
22680,FRENCH BLUE METAL DOOR SIGN 5,775,969.97,107
84559B,3D SHEET OF CAT STICKERS,1140,969.0,150
21277,FRENCH STYLE EMBOSSED HEART CABINET,45,968.8,40
21759,METAL WALL SHELF UNIT WITH HOOKS,27,968.08,11
22321,BIRD DECORATION RED SPOT,1139,966.5899999999999,84
84969,ASSORTED COLOUR SET 6 TEASPOONS,227,964.75,63
84800L,LARGE WHITE/PINK ROSE ART FLOWER,647,964.4300000000001,37
85008,SET OF 3 CONEY ISLAND OVAL BOXES,259,961.8,89
84687,BEACH HUT SHELF W 3 DRAWERS,292,961.4,52
23281,FOLDING BUTTERFLY MIRROR RED  ,1252,961.2800000000001,89
85126,LARGE ROUND CUTGLASS CANDLESTICK,148,960.6,32
23121,PACK OF 6 COCKTAIL PARASOL STRAWS,2460,958.32,87
22266,EASTER DECORATION HANGING BUNNY,2476,958.3,123
72484,ROSES IN WHITE HEART CANDLE ,1805,958.21,54
22860,EASTER TIN CHICKS PINK DAISY,580,957.0,88
84750B,BLACK SMALL GLASS CAKE STAND,564,956.64,55
82001S,SILVER RECORD COVER FRAME,272,955.86,19
85197,SET OF 12 MINI BUNNIES IN A BUCKET,1667,955.26,73
23518,EMBROIDERED RIBBON REEL RACHEL ,357,954.93,41
22701,PINK DOG BOWL,552,954.7800000000001,86
21250,SET OF SKULL WALL STICKERS,394,950.5,53
84664,CHERRY BLOSSOM BATHROOM CABINET,192,950.4,50
72753B,S/3 FLWR FAIRY LAVENDER CANDLES,444,949.95,13
22717,CARD DOG AND BALL ,2322,949.32,152
23088,ZINC HEART FLOWER T-LIGHT HOLDER,760,947.18,57
22986,WRAP GINGHAM ROSE ,2276,943.92,82
23033,DRAWER KNOB CERAMIC RED,679,943.75,59
22597,MUSICAL ZINC HEART DECORATION ,2498,943.64,113
22280,POCKET BAG PINK PAISELY BROWN SPOT,579,943.03,87
78124,MAGAZINE RACK GEBRA ASSORTED ,718,942.5,26
47504H,ENGLISH ROSE SPIRIT LEVEL ,989,940.83,105
85019B,BLOSSOM  IMAGES NOTEBOOK SET,704,940.0,36
22105,MIRROR MOSAIC GOBLET CANDLE HOLDER,613,937.25,26
37492B,BLUE YELLOW FLOWER PIGGY BANK,488,937.1999999999999,43
35648,VINTAGE BEAD PINK PURSE ,867,937.0100000000001,68
23533,WALL ART GARDEN HAVEN ,210,936.34,31
35958,FOLKART ZINC STAR CHRISTMAS DEC,1100,935.0,69
85160B,BLACK BIRD GARDEN DESIGN MUG,6149,934.87,30
23402,HOME SWEET HOME 3 PEG HANGER ,255,934.1700000000001,51
21636,MADRAS NOTEBOOK MEDIUM,1003,934.05,88
22995,TRAVEL CARD WALLET SUKI,2228,932.88,183
23525,WALL ART BUFFALO BILL ,321,932.6700000000001,29
23331,DECORATIVE WICKER HEART SMALL,1492,932.28,81
20932,PINK POT PLANT CANDLE,305,932.0500000000001,56
21690,SILVER  CANDLEPOT JARDIN ,248,929.2,75
21425,SKULLS STORAGE BOX LARGE,450,928.1400000000001,58
21562,HAWAIIAN GRASS SKIRT ,664,926.71,63
22116,METAL SIGN HIS DINNER IS SERVED,735,924.69,127
21814,HEART T-LIGHT HOLDER ,639,924.15,71
23527,ANIMALS AND NATURE WALL ART,267,923.97,17
23153,ZINC SWEETHEART WIRE LETTER RACK,248,923.63,78
21711,FOLDING UMBRELLA  WHITE/RED  SPOT,259,922.05,26
23512,EMBROIDERED RIBBON REEL ROSIE,484,921.46,49
20758,ABSTRACT CIRCLES POCKET BOOK,5378,920.9,74
84817,DANISH ROSE DECORATIVE PLATE,1051,920.64,77
23566,EGG CUP MILKMAID HEIDI,784,919.52,46
21061,PARTY INVITES FOOTBALL,1303,919.27,124
21702,SET 5 MINI GATEAUX  FRIDGE MAGNETS,2636,918.6800000000001,8
21707,FOLDING UMBRELLA BLACKBLUE POLKADOT,184,918.02,70
22119, PEACE WOODEN BLOCK LETTERS,133,917.15,47
22529,MAGIC DRAWING SLATE GO TO THE FAIR ,2295,916.38,136
84929,ASSTD FRUIT+FLOWERS FRIDGE MAGNETS,2928,915.12,90
20707,CRAZY DAISY HEART DECORATION,1279,914.12,63
15058B,PINK POLKADOT GARDEN PARASOL,121,913.95,44
21131,GOLD STANDING GNOME,253,910.25,28
84358,FLOOR LAMP SHADE WOOD BASE,113,909.63,22
23514,EMBROIDERED RIBBON REEL SALLY ,458,909.14,62
85189,HANGING BUTTERFLY  EGG,1117,908.89,58
21630,FLOOR CUSHION ELEPHANT CARNIVAL,104,908.8,47
22324,BLUE POLKADOT KIDS BAG,447,906.81,66
72045D,ROSES ON BLUE TEACUP CANDLE ,536,905.84,3
22786,CUSHION COVER PINK UNION JACK,163,903.89,58
22321,BIRD DECORATION RED RETROSPOT,1085,903.53,73
22707,WRAP MONSTER FUN ,2150,903.0,81
23510,MINI PLAYING CARDS GYMKHANA,2297,901.74,95
85018D,YULETIDE IMAGES S/6 PAPER BOXES,762,901.5,63
21269,ANTIQUE CREAM CUTLERY SHELF ,106,901.0,58
46000P,POLYESTER FILLER PAD 65CMx65CM,212,901.0,48
35962,12 ASS ZINC CHRISTMAS DECORATIONS,429,900.9000000000001,45
84405A,S/3 PINK COL METAL BASKET W HANDLE,122,900.3000000000001,45
20671,BLUE TEATIME PRINT BOWL ,731,900.07,106
84625A,PINK NEW BAROQUECANDLESTICK CANDLE,788,898.7,61
21691,SILVER VANILLA FLOWER CANDLE POT,240,898.56,66
23529,WALL ART DOLLY GIRL ,311,896.3700000000001,19
84760L,LARGE HANGING GLASS+ZINC LANTERN,560,896.0,1
23419,HOME SWEET HOME BOTTLE ,437,895.0400000000001,61
17109B,FLOWER FAIRY INCENSE LAVENDER,4541,892.91,16
84666,SQUARE CHERRY BLOSSOM CABINET,226,892.7,33
22939,ADULT APRON APPLE DELIGHT,179,891.9300000000001,40
20778,GARDEN PATH NOTEBOOK ,3595,891.75,80
84360,TABLE LAMP WHITE SHADE WOOD BASE,173,891.5500000000001,35
37475,SET/4 COLOURFUL MIXING BOWLS,94,891.5,51
20773,BLUE PAISLEY NOTEBOOK,3303,889.9499999999999,95
21725,SWEETIES  STICKERS,1047,889.9499999999999,109
85104,SILVER GLASS T-LIGHT SET,327,888.9300000000001,51
22512,DOORSTOP RACING CAR DESIGN,375,888.23,63
21746,SMALL RED SPOT  WINDMILL,742,886.46,52
22096,PINK PAISLEY SQUARE TISSUE BOX ,1646,886.28,163
23528,SPACEBOY WALL ART,306,885.9000000000001,13
22643,SET OF 4 NAPKIN CHARMS LEAVES   ,405,882.99,76
22994,TRAVEL CARD WALLET RETROSPOT,2104,882.24,160
22598,CHRISTMAS MUSICAL ZINC TREE,1562,881.72,93
21291,SMALL SPOTTY CHOCOLATE GIFT BAG ,1049,881.5699999999999,65
46775D,SUNSET COLOUR CHUNKY KNITTED THROW,52,881.4,32
85111,SILVER GLITTER FLOWER VOTIVE HOLDER,2872,879.92,63
84974,S/2 ZINC HEART DESIGN PLANTERS,89,879.55,57
72799A,BLACK PILLAR CANDLE SILVER FLOCK,612,877.8000000000001,18
20934,SET/3 POT PLANT CANDLES,167,877.1500000000001,47
85019A,ROMANTIC IMAGES NOTEBOOK SET,639,876.75,41
23540,WALL ART THE MAGIC FOREST ,144,876.64,9
21708,FOLDING UMBRELLA CREAM POLKADOT,178,875.5000000000001,42
21805,WHITE CHRISTMAS TREE DECORATION ,2124,874.8,82
23107,WHITE HEARTS WIRE PLANT POT HOLDER,324,873.5600000000001,59
47504E,ENGLISH ROSE SCISSORS,4372,871.4,37
84625C,BLUE NEW BAROQUE CANDLESTICK CANDLE,743,870.95,57
22679,FRENCH BLUE METAL DOOR SIGN 4,695,870.57,102
20798,CLEAR MILKSHAKE GLASS,445,869.7,41
21726,MULTI HEARTS  STICKERS,1038,869.3,127
17033,"BROCADE PURSE,SMALL ARCH BUTTON",3279,867.55,68
84637,KITCHEN FLOWER POTS WALL PLAQUE,487,867.25,33
21189,WHITE HONEYCOMB PAPER GARLAND ,543,866.75,61
35923,CANDY HEART HANGING DECORATION,1453,866.71,66
22896,PEG BAG APPLE DESIGN,384,866.7,28
35599D,PINK AND WHITE CHRISTMAS TREE 120CM,322,866.58,39
84826,ASSTD DESIGN 3D PAPER STICKERS,1731,866.53,50
22647,CERAMIC LOVE HEART MONEY BANK,1042,866.5,68
23545,WRAP RED VINTAGE DOILY,2100,866.0,68
22264,FELT FARM ANIMAL WHITE BUNNY ,1803,865.7099999999999,88
21060,PARTY INVITES BALLOON GIRL,1208,864.1999999999999,123
20617,FIRST CLASS PASSPORT COVER ,452,863.88,74
84791,GINGHAM HEART DECORATION,296,863.6000000000001,75
20759,CHRYSANTHEMUM POCKET BOOK ,5734,863.5,44
21391,FRENCH LAVENDER SCENT HEART,972,861.3,77
23517,EMBROIDERED RIBBON REEL REBECCA ,312,860.88,51
23002,TRAVEL CARD WALLET SKULLS,2052,860.4,140
21945,STRAWBERRIES  DESIGN FLANNEL ,1518,859.64,73
23099,FRENCH CARRIAGE LANTERN,132,858.9000000000001,54
22814,CARD PARTY GAMES ,2126,858.36,135
22069,BROWN  PIRATE TREASURE CHEST ,603,858.33,82
84925F,PSYCHEDELIC WALL THERMOMETER,711,857.9300000000001,31
20780,BLACK EAR MUFF HEADPHONES,174,857.6,58
84796A,PINK HAWAIIAN PICNIC HAMPER FOR 2,150,856.5,25
20757,RED DAISY POCKET BOOK ,5301,856.23,55
21815,STAR  T-LIGHT HOLDER ,592,855.9999999999999,60
21720,CAKE SHOP  STICKER SHEET,1023,854.99,87
23532,WALL ART WORK REST AND PLAY  ,205,853.47,26
22288,"DECORATION , HANGING METAL RABBIT",813,851.25,47
21007,ETCHED GLASS DROPLET DECORATION,1905,851.23,39
21721,CANDY SHOP  STICKER SHEET,1005,851.13,89
20991,JAZZ HEARTS MAGNETIC MEMO PAD,7058,850.9000000000001,16
85129D,BEADED CRYSTAL HEART PINK SMALL,655,850.35,85
84596E,SMALL LICORICE DES PINK BOWL,880,850.2,124
85226A,WHITE/BLUE PULL BACK RACING CAR,1658,849.5,114
21303,FILIGREE WALL MIRROR  ANTIQUE WHITE,92,848.8,26
21338,MARAKESH LANTERN SMALL ,196,848.35,11
22255,FELT TOADSTOOL  SMALL,998,848.3,87
21284,RETROSPOT CANDLE  SMALL,1116,847.88,60
85032B,BLOSSOM IMAGES GIFT WRAP SET,929,846.0,106
20801,LARGE PINK GLASS SUNDAE DISH,902,845.86,69
22821,GIFT BAG PSYCHEDELIC APPLES,1300,845.36,103
23525,BUFFALO BILL WALL ART ,246,845.22,15
21836,GINGHAM OVEN GLOVE RED HEART ,225,843.75,80
85124A,PINK JUICY FRUIT PHOTO FRAME,339,843.75,70
20774,GREEN FERN NOTEBOOK,3419,841.35,76
20622,VIPPASSPORT COVER ,488,840.6800000000001,71
84782A,PINK 3 TIER GLASS PLATE STAND,119,840.45,26
21127,COLOURFUL FISHING GNOME,284,838.6,36
23178,JAM CLOCK MAGNET,309,838.47,55
21299,EDWARDIAN TOILET ROLL UNIT ,161,838.35,29
84985A,SET OF 72 GREEN PAPER DOILIES,578,838.0999999999999,119
23179,CLOCK MAGNET MUM'S KITCHEN,304,837.88,40
85025B,EAU DE NILE HEART SHAPE PHOTO FRAME,525,837.45,65
21635,MADRAS NOTEBOOK LARGE ,395,836.25,39
22250,DECORATION  BUTTERFLY  MAGIC GARDEN,1018,836.18,109
21780,MA CAMPAGNE 4 DRAWER WALL SHELF,125,835.55,17
21261,GREEN GOOSE FEATHER CHRISTMAS TREE ,245,834.7500000000001,43
22143,CHRISTMAS CRAFT HEART DECORATIONS,420,834.0,53
20878,SET/9 CHRISTMAS T-LIGHTS SCENTED ,689,833.89,67
90200D,PINK SWEETHEART BRACELET,199,833.75,55
21062,PARTY INVITES SPACEMAN,1009,833.53,120
23523,TREASURE AHOY WALL ART,270,833.46,16
20786,BLACK RETRO BAR STOOL,22,830.9,9
72529W,WHITE ADVENT CANDLE,443,829.08,39
35599B,BLACK CHRISTMAS TREE 120CM,249,828.5699999999999,38
84820,DANISH ROSE TRINKET TRAYS,317,828.15,49
85124B,BLUE JUICY FRUIT PHOTO FRAME,331,827.85,84
21392,RED SPOTTY PUDDING BOWL,3818,827.04,24
21650,ASSORTED TUTTI FRUTTI BRACELET,2791,826.99,101
21664,RIDGED GLASS STORAGE JAR CREAM LID,227,825.3299999999999,54
84341B,SMALL PINK MAGIC CHRISTMAS TREE,1690,825.03,94
85130D,BEADED CRYSTAL HEART PINK LARGE,734,824.28,80
22682,FRENCH BLUE METAL DOOR SIGN 7,658,823.11,85
23502,PLAYING CARDS VINTAGE DOILY ,677,822.73,85
22310,KNITTED MUG COSY IVORY COLOUR ,546,821.7,28
23338,EGG FRYING PAN RED ,405,820.32,91
23479,WIRE EGG BASKET ,109,819.65,40
22893,MINI CAKE STAND T-LIGHT HOLDER,2006,819.48,93
23186,FRENCH STYLE STORAGE JAR CAFE ,1982,819.4599999999999,70
85135C,RED DRAGONFLY HELICOPTER,103,818.85,65
22268,EASTER DECORATION SITTING BUNNY,1010,817.9399999999999,110
22681,FRENCH BLUE METAL DOOR SIGN 6,652,816.82,86
20756,GREEN FERN POCKET BOOK,5679,816.7499999999999,44
72598,SET/12 TAPER CANDLES,1042,815.14,89
84660A,WHITE STITCHED WALL CLOCK,851,814.4,42
84750A,PINK SMALL GLASS CAKE STAND,447,814.05,49
17039,INLAID WOOD INCENSE HOLDER,3641,813.0899999999999,30
22164,STRING OF STARS CARD HOLDER,303,812.2500000000001,42
20833,SHAKER THROW  QUILTED,52,811.8,5
85159A,"BLACK TEA,COFFEE,SUGAR JARS",456,811.1999999999999,48
21944,KITTENS DESIGN FLANNEL,1538,811.0999999999999,75
85231L,LAVENDER SCENTED SET/9 T-LIGHTS,1018,810.6999999999999,101
85145,JARDIN ETCHED GLASS LARGE BELL JAR,91,809.05,30
22953,BIRTHDAY PARTY CORDON BARRIER TAPE,665,807.52,96
47589,CONGRATULATIONS BUNTING,148,806.6,70
35957,SMALLFOLKART BAUBLE CHRISTMAS DEC,3313,806.3399999999999,62
21552,CERAMIC BIRDHOUSE BLACK ROSE  LARGE,162,805.6500000000001,32
85130B,BEADED CRYSTAL HEART GREEN LARGE,875,805.0500000000001,59
84660B,BLACK STITCHED WALL CLOCK,727,804.65,44
84632,DECORATIVE HANGING SHELVING UNIT,14,799.3000000000001,10
85166B,BLACK METAL BAROQUE PHOTO FRAME,501,798.75,31
23524,HORSE & PONY WALL ART,256,797.3100000000001,17
23022,SMALL BONNE JAM JAR  T-LIGHT HOLDER,416,795.6800000000001,21
82616B,FRAPPUCINO SCARF KNITTING KIT,533,794.9300000000001,75
21580,RABBIT  DESIGN  COTTON TOTE BAG,361,794.25,89
21331,MOROCCAN BEATEN METAL DISH LARGE,104,793.74,24
35598B,BLACK CHRISTMAS TREE 60CM,919,792.85,48
22247,BUNNY DECORATION MAGIC GARDEN,971,792.0699999999999,102
20867,PINK ROSE FABRIC MIRROR,844,791.72,75
82616C,MIDNIGHT GLAMOUR SCARF KNITTING KIT,539,791.22,78
21676,FLOWERS  STICKERS,1102,787.3599999999999,98
20913,SET/5 BLUE SPOTTY LID GLASS BOWLS,295,787.05,30
84685,BEACH HUT KEY CABINET,359,786.25,54
21555,CERAMIC STRAWBERRY TRINKET TRAY,316,784.2,51
85196,EASTER BUNNIES ON A STICK,1536,783.96,66
85194S,HANGING SPRING FLOWER EGG SMALL,1680,783.8,95
84767,ZINC POLICE BOX LANTERN,193,783.7,4
23380,PACK OF 12 VINTAGE DOILY TISSUES,2087,783.6899999999999,92
21264,WHITE GOOSE FEATHER TREE 60CM ,352,782.4,57
20669,RED HEART LUGGAGE TAG,627,781.47,132
21801,CHRISTMAS TREE DECORATION WITH BELL,1860,781.1999999999999,80
21318,GLASS CHALICE BLUE SMALL ,936,780.3,77
23004,TRAVEL CARD WALLET PANTRY,1853,779.9,123
21414,SCALLOP SHELL SOAP DISH,1614,779.4,20
85135B,BLUE DRAGONFLY HELICOPTER,98,779.1,76
21724,PANDA AND BUNNIES STICKER SHEET,916,778.5999999999999,126
84660C,PINK STITCHED WALL CLOCK,689,778.07,55
23472, NINE DRAWER OFFICE TIDY,54,777.9,30
22216,T-LIGHT HOLDER WHITE LACE,1069,775.5699999999999,57
23220,REINDEER HEART DECORATION GOLD,929,774.4300000000001,77
84907,PINK YELLOW PATCH CUSHION COVER,359,774.1500000000001,11
21551,CERAMIC BIRDHOUSE BUTTERFLY LARGE,165,772.95,19
85163A,WHITE BAROQUE WALL CLOCK ,79,772.65,41
21632,VINTAGE PINK DECORATIVE PARASOL,102,772.5,32
85170D,SET/6 PINK BIRD T-LIGHT CANDLES,574,772.1899999999999,77
85032C,CURIOUS IMAGES GIFT WRAP SET,793,772.1,100
23409,PHOTO FRAME LINEN AND LACE LARGE,208,771.72,41
84908A,PINK 5 PATCH FLOWER CUSHION COVER ,387,769.65,7
22936,BAKING MOULD ROSE WHITE CHOCOLATE,258,766.88,33
16259,PIECE OF CAMO STATIONERY SET,5473,766.09,55
84659A,WHITE TRAVEL ALARM CLOCK,311,765.66,71
85188A,GREEN METAL SWINGING BUNNY,904,765.28,81
21444,BLUE CHALET BIRDFEEDER,273,763.75,20
23458,DOLLY CABINET 3 DRAWERS ,51,762.4499999999999,30
22820,GIFT BAG BIRTHDAY,1172,761.98,76
23550,WRAP ALPHABET POSTER  ,1850,761.0,63
47593B,SCOTTIE DOGS BABY BIB,1730,760.14,107
37327,ASSTD MULTICOLOUR CIRCLES MUG,1535,759.59,52
22420,LIPSTICK PEN BABY PINK,1818,758.87,149
23423,PANTRY 3 HOOK ROLLING PIN HANGER,202,757.5,51
22985,WRAP BILLBOARD FONTS DESIGN,1800,756.0,62
21298,EDWARDIAN 2 DRAWER WALL CABINET ,52,755.8,14
84908B,BLUE 5 PATCH FLOWER CUSHION COVER,385,755.75,5
23519,EMBROIDERED RIBBON REEL CLAIRE,219,755.01,19
21335,LIBRARY LAMP,36,754.1999999999999,22
23487,SWEET HEART CAKE CARRIER,78,754.0,42
35646,VINTAGE BEAD PINK EVENING BAG,533,753.88,51
21629,SQUARE FLOOR CUSHION VINTAGE RED,96,753.2,46
22547,MINI JIGSAW DINOSAUR ,1864,752.43,109
23017,APOTHECARY MEASURING JAR,64,751.4000000000001,21
22825,DECORATIVE PLANT POT WITH FRIEZE,96,751.2,34
17165B,ASS COL LARGE SAND GECKO P'WEIGHT,809,750.63,56
72755C,FLOWER FAIRY OIL BURNER SET ROSE,588,750.0,13
20775,DAISY NOTEBOOK ,3509,749.85,53
82613D,METAL SIGN CUPCAKE SINGLE HOOK,852,749.6,126
22058,CERAMIC LOVE HEARTS DESIGN MUG,503,749.47,92
22683,FRENCH BLUE METAL DOOR SIGN 8,598,749.32,83
84922,PINK BUTTERFLY WASHBAG,335,748.75,10
17012C,ORIGAMI LAVENDER INCENSE/CANDL SET ,777,747.25,56
23106,ZINC HEARTS PLANT POT HOLDER,275,746.15,49
37330,SPOTS MUG,426,744.2999999999998,17
20989,URBAN CHIC CHOPSTICKS SET/5,397,744.15,48
21641,ASSORTED TUTTI FRUTTI KEYRING BALL,1541,741.1299999999999,48
21503,TOYBOX  WRAP ,1801,740.42,64
21014,SWISS CHALET TREE DECORATION ,1662,737.66,107
21300,ANTIQUE EDWARDIAN DRESSER,52,737.4,11
21851,LILAC DIAMANTE PEN IN GIFT BOX,383,736.67,46
84247E,PACK/12 XMAS FUN CARD,256,736.0000000000001,56
21286,RETROSPOT CANDLE  LARGE,690,735.82,37
84625D,WHITE NEWBAROQUE CANDLESTICK CANDLE,639,734.25,46
21456,2 PICTURE BOOK EGGS EASTER CHICKS,718,732.5,51
21458,2 PICTURE BOOK EGGS EASTER BUNNY,718,732.5,57
ADJUST2,Adjustment by Peter on Jun 25 2010 ,3,731.0500000000001,3
22230,JIGSAW TREE WITH WATERING CAN,1366,731.02,123
21398,RED POLKADOT COFFEE  MUG,1541,730.9499999999999,53
71279,PINK GLASS CANDLEHOLDER,251,730.8500000000001,52
47503F,ASS FLORAL PRINT TORCH,2567,729.9499999999999,11
21554,CERAMIC BIRDHOUSE RED ROOF LARGE,163,729.85,19
21285,RETROSPOT CANDLE  MEDIUM,726,729.62,50
21880,RED RETROSPOT TAPE,1548,727.44,111
21320,GLASS CHALICE GREEN  LARGE ,358,726.6600000000001,36
85180B,PINK HEARTS LIGHT CHAIN ,279,726.63,32
22408,MONEY BOX CONFECTIONERY DESIGN,614,726.35,75
90147,CHUNKY SILVER NECKLACE PASTEL FLOWE,73,726.3499999999999,38
22785,SQUARECUSHION COVER PINK UNION FLAG,108,725.8,44
85230F,JASMINE VOTIVE CANDLE,2944,725.1199999999999,61
85187,S/12 MINI RABBIT EASTER,451,724.9499999999999,88
22493, PAINT YOUR OWN CANVAS SET,480,724.8,17
23335,EGG FRYING PAN IVORY ,358,722.5600000000001,81
85121C,RETRO LAUNDRY TUB PISTACHIO,85,722.5,42
84821,DANISH ROSE DELUXE COASTER,1306,722.5,67
21185, HOME SWEET HOME  BLACKBOARD,117,722.3100000000001,33
84596L,BISCUITS SMALL BOWL LIGHT BLUE,1262,720.9399999999999,130
20941,FROG CANDLE,928,719.62,69
16011,ANIMAL STICKERS,3427,718.47,100
84600,NEW BAROQUE JEWELLERY BOX ,94,717.3000000000001,39
21376,LARGE  TALL CAMPHOR WOOD TOADSTOOL ,171,717.15,38
37423,WHITE WITH BLACK CATS PLATE,6091,716.23,25
84631,FRUIT TREE AND BIRDS WALL PLAQUE,253,715.35,24
22492,MINI PAINT SET VINTAGE  BOY+ GIRL,1188,714.5999999999999,17
84638,SMALL KITCHEN FLOWER POTS PLAQUE,356,714.2,31
20850,ZINC HEART LATTICE PLANTER BOWL,820,713.8000000000001,23
84963A,PINK PAINTED KASHMIRI CHAIR,22,713.4000000000001,8
35965,FOLKART HEART NAPKIN RINGS,375,713.3700000000001,82
16015,MEDIUM CHINESE STYLE SCISSOR,1572,711.38,65
90200E,GREEN SWEETHEART BRACELET,170,710.5,53
21208,PASTEL COLOUR HONEYCOMB FAN,981,709.89,75
23006,TRAVEL CARD WALLET FLOWER MEADOW,1693,709.62,130
21129,SILVER FISHING GNOME ,105,709.3000000000001,42
20769,DAISY JOURNAL ,403,708.47,61
22685,FRENCH BLUE METAL DOOR SIGN 0,567,708.15,74
85130C,BEADED CRYSTAL HEART BLUE  LARGE,650,707.86,61
21344,MOROCCAN BEATEN METAL DISH,164,707.8000000000001,24
85136A,YELLOW SHARK HELICOPTER,89,707.55,67
23123,COCKTAIL SWORDS 50 PIECES,899,705.2500000000001,68
20936,FORKED CACTUS CANDLE,309,704.33,55
23564,EGG CUP MILKMAID INGRID,587,703.51,42
21417,COCKLE SHELL DISH,424,702.88,58
10134,COLOURING PENCILS BROWN TUBE,612,702.3,48
85208,SET/12 FUNKY FELT FLOWER PEG IN BAG,353,701.94,59
84849A,HELLO SAILOR BLUE SOAP HOLDER,430,700.78,68
21374,MIRRORED WALL ART SKULLS,454,700.0,61
22676,"FRENCH BLUE METAL DOOR SIGN, 1",560,700.0,67
20892,SET/3 TALL GLASS CANDLE HOLDER PINK,86,699.7,23
22486,PLASMATRONIC LAMP,85,698.89,25
21719,LOVELY BONBON STICKER SHEET,824,698.8399999999999,92
20776,ABSTRACT CIRCLES NOTEBOOK,3187,698.55,53
37461,FUNKY MONKEY MUG,710,697.9,66
21654,RIDGED GLASS FINGER BOWL,1129,696.2099999999999,62
23187,FRENCH STYLE STORAGE JAR BONBONS,2338,695.06,74
21427,SKULLS STORAGE BOX SMALL,441,694.5,73
22104,MIRROR MOSAIC CANDLE PLATE,1026,694.26,41
21393,BLUE  SPOTTY PUDDING BOWL,2672,694.08,24
72755D,FLOWER FAIRY OIL BURNER SET SUMMER,533,693.25,13
85093,CANDY SPOT EGG WARMER HARE,1044,692.74,59
85214,TUB 24 PINK FLOWER PEGS,419,691.35,135
21133,PAINTED BIRD ASSORTED CHRISTMAS,409,691.21,41
21942,SKULLS DESIGN FLANNEL,1322,691.2,64
23183,MOTHER'S KITCHEN SPOON REST ,178,690.71,58
23222,CHRISTMAS TREE HANGING GOLD,776,690.64,64
84707A,SILVER JEWELLED MIRROR TRINKET TRAY,91,689.49,40
79342B,BROWN FLOWER LIGHTS,109,688.95,24
72131,COLUMBIAN CANDLE RECTANGLE,746,688.38,55
21723,ALPHABET HEARTS STICKER SHEET,807,685.9499999999999,93
82607A,GLASS BONBON JAR PARFUME AUX FLEURE,568,684.73,88
84715,SET OF 6 ICE CREAM SKITTLES,232,684.4000000000001,39
23115,RED APPLES CHOPPING BOARD   ,144,684.0,38
23114,VINTAGE LEAF CHOPPING BOARD  ,144,684.0,41
85127,SMALL SQUARE CUT GLASS CANDLESTICK,138,683.1,37
79030G,"TUMBLER, NEW ENGLAND",472,683.04,52
22847,"BREAD BIN, DINER STYLE, IVORY",45,682.7499999999999,10
17165D,ASS COL LARGE SAND FROG P'WEIGHT,716,682.32,89
21443,OLIVE CHALET BIRDFEEDER,251,681.25,20
20803,SMALL PINK GLASS SUNDAE DISH,1091,680.91,61
21674,RIDGED GLASS PENDANT LAMPSHADE,43,680.8499999999999,9
84971L,LARGE HEART FLOWERS HOOK   ,568,680.36,43
85023B,EAU DE NILE JEWELLED PHOTOFRAME,292,679.8000000000001,37
21480,PINK STRIPE HOT WATER BOTTLE,245,679.5500000000001,38
23562,SET OF 6 RIBBONS PERFECTLY PRETTY  ,243,678.27,37
84925D,LA PALMIERA WALL THERMOMETER,452,677.4499999999999,26
21255,"FRENCH BOTTLE , LAVENDER",422,677.1,55
72800A,S/4 BLACK DINNER CANDLE SILVER FLOC,661,676.71,34
21850,BLUE  DIAMANTE PEN IN GIFT BOX,321,675.75,43
84842,HELLO SAILOR BATHROOM SET,1495,675.05,26
21222,SET/4 BADGES BEETLES,530,672.18,84
21286,RETRO SPOT CANDLE  LARGE,272,672.0,30
21391,FRENCH EMROIDR LAVENDER SCENT HEART,320,672.0,55
84689,S/2 BEACH HUT TREASURE CHESTS,305,671.65,34
35951,FOLKART BAUBLE CHRISTMAS DECORATION,1339,671.51,40
22965,3 TRADITIONAL COOKIE CUTTERS  SET,354,671.4000000000001,10
72799C,PINK PILLAR CANDLE SILVER FLOCK,452,670.28,39
21265,PINK GOOSE FEATHER TREE 60CM,315,670.25,28
23223,CHRISTMAS TREE HANGING SILVER ,745,670.11,67
85071C,"CHARLIE+LOLA""EXTREMELY BUSY"" SIGN",1197,669.8199999999999,98
23025,DRAWER KNOB VINTAGE GLASS BALL,317,669.61,46
85213,MINI  ZINC GARDEN DECORATIONS ,1270,669.5799999999999,49
22036,DINOSAUR BIRTHDAY CARD,1618,668.76,110
84615,PINK ROUND BUTTERFLY MIRROR ,235,667.8299999999999,18
72753A,S/3 FLWR FAIRY LILLY CANDLES,312,666.9000000000001,11
84029C,BROWN FURRY HOT WATER BOTTLE,191,665.05,38
23568,EGG CUP HENRIETTA HEN CREAM ,580,664.52,28
37492D,PURPLE GREEN FLOWER PIGGY BANK,359,664.35,24
21457,2 PICTURE BOOK EGGS EASTER DUCKS,663,663.75,48
21478,SILVER SKULL HOT WATER BOTTLE ,179,662.61,76
23024,LARGE BONNE JAM JAR  T-LIGHT HOLDER,254,662.0600000000001,10
23597,PAPER BUNTING PAISLEY PARK,246,661.7,28
85231E,STRAWBERRY SCENTED SET/9 T-LIGHTS,815,661.55,93
23547,WRAP FLOWER SHOP  ,1575,661.5,62
17109C,FLOWER FAIRY INCENSE ROSE,3124,661.23,15
72750B,FLOWER FAIRY SET 3 CANDLES LAVENDER,302,660.9,29
84620,BLUE GINGHAM ROSE CUSHION COVER,111,660.45,46
72800B,S/4 PURPLE DINNER CANDLE BLK FLOCK,636,660.12,26
35095B,RED VICTORIAN FABRIC OVAL BOX,1824,659.87,92
21764,VINTAGE WOODEN PLATE RACK,17,659.1500000000001,11
23140,TRIPLE WIRE HOOK IVORY HEART,160,658.54,35
23042,PAPER LANTERN 7 POINT SNOW STAR,99,658.35,25
21220,SET/4 BADGES DOGS,516,658.31,82
20783,HEART EAR MUFF HEADPHONES,130,658.26,34
84976,RECTANGULAR SHAPED MIRROR,652,656.9,42
84686,BEACH HUT MIRROR,344,654.54,37
21308,LOUVRE VANITY MIRROR,129,653.85,3
84595E,LARGE TORTILLA DESIGN RED BOWL,350,653.0999999999999,27
20862,PINK PATCH PENCIL CASE BLUE HEART,316,652.5300000000001,28
35647,VINTAGE BEAD PINK SHADE ,525,652.5,43
23482,PEARLISED IVORY HEART LARGE ,415,651.15,36
20894,HANGING BAUBLE T-LIGHT HOLDER LARGE,227,650.45,60
21084,SET/6 COLLAGE PAPER CUPS,2486,650.4000000000001,136
22248,DECORATION  PINK CHICK MAGIC GARDEN,773,648.73,85
16169K,WRAP FOLK ART,2050,648.25,59
22383,LUNCHBAG SUKI  DESIGN ,405,648.25,32
47591B,SCOTTIES CHILDRENS APRON,423,647.55,76
21758,VINTAGE SHELLS PRINT,101,647.45,45
85028S,FRENCH CHATEAU SMALL FRUITBOWL,429,646.65,32
21350,GINGHAM HEART WREATH,224,644.8000000000001,41
23408,PHOTO FRAME LINEN AND LACE SMALL,310,644.8000000000001,59
23524,WALL ART HORSE & PONY ,209,644.6700000000001,34
22033,BOTANICAL ROSE GREETING CARD,1552,644.64,107
23120,PACK OF 6 SMALL FRUIT STRAWS,1617,644.58,79
22229,BUNNY WOODEN PAINTED WITH FLOWER ,860,644.52,114
22785,CUSHION COVER PINK UNION FLAG,101,643.35,22
23325,RUSTIC STRAWBERRY JAM POT SMALL,408,642.0,27
16169M,WRAP DAISY CARPET ,2060,640.95,59
21319,GLASS CHALICE GREEN  SMALL ,474,640.26,48
22638,SET OF 4 NAPKIN CHARMS CROWNS ,357,640.12,59
85163B,BLACK BAROQUE WALL CLOCK ,68,639.6,37
84766,SILVER ROCOCO CANDLE STICK,200,638.0,27
20998,ROSE DU SUD OVEN GLOVE,217,637.35,58
22034,ROBIN CHRISTMAS CARD,1533,635.22,83
23298,"BUNTING , SPOTTY ",146,634.7,7
85019C,CURIOUS  IMAGES NOTEBOOK SET,421,634.25,23
85031A,ROMANTIC IMAGES SCRAP BOOK SET,386,634.2,38
17164B,ASS COL SMALL SAND GECKO P'WEIGHT,1584,633.24,80
84869,CANDY BUTTON PHOTO ALBUM,295,631.25,21
40018E,TEA TIME PAPER LANTERNS,334,630.5,48
84964A,PINK PAINTED KASHMIRI TABLE,11,630.0,2
22640,SET OF 4 NAPKIN CHARMS 3 KEYS ,298,629.82,69
23551,PACK OF 12 PAISLEY PARK TISSUES ,1614,629.4599999999999,95
84709B,PINK OVAL JEWELLED MIRROR,111,629.25,41
23019,SMALL APOTHECARY MEASURING JAR ,81,629.05,28
84033,FLAG OF ST GEORGE ,381,628.65,44
